user_input,retrieved_contexts,response,reference,faithfulness,answer_relevancy,context_precision,context_recall
 توحيد المنصات والخدمات الرقمية,"['Content: السادة المستشارون المحترمون\xa0\n\n- فريق الاتحاد المغربي للشغل -\xa0\n\n-مجلس المستشارون-\xa0\n\n\u202f\xa0\n\nالموضوع: توحيد المنصات والخدمات الرقمية\n\nالمرجـــع: سؤالكم الشفوي رقم 10210\n\n\u202f\xa0\n\n\u202f\xa0\n\nسلام تام بوجود مولانا الإمام،\xa0\n\n\u202fالسيد الرئيس المحترم،\u202f\xa0\n\nأشكركم على هذا السؤال الذي يهم أحد الأوراش الأساسية للتحول الرقمي، والمتمثل في توحيد الولوج إلى الخدمات العمومية الرقمية وتحسين تجربة المرتفق.\n\nوفي هذا الإطار، تعتمد الوزارة مقاربة متكاملة تقوم على الانتقال من تعدد المنصات إلى توفير تجربة رقمية موحدة، ترتكز على توحيد مختلف الخدمات الرقمية التي تقدمها الإدارات العمومية.', 'Content: السادة النواب المحترمون\xa0\n\n- فريق الأصالة والمعاصرة -\xa0\n\n-مجلس النواب-\xa0\n\n\u202f\xa0\n\nالموضوع: سؤالكم الآني حول فعالية المنصات الرقمية\xa0\n\nالمرجـــع: سؤالكم الآني رقم 14580\n\n\u202f\xa0\n\n\u202f\xa0\n\nسلام تام بوجود مولانا الإمام،\xa0\n\n\u202fالسيد الرئيس المحترم،\u202f\xa0\n\nالسيدات والسادة النواب المحترمون،\n\nأشكركم على هذا السؤال الذي يهم تحسين جودة المنصات الرقمية العمومية، باعتباره أحد المرتكزات الأساسية للتحول الرقمي وتحسين جودة الخدمات العمومية.\n\nوفي هذا الإطار، تعمل الوزارة، بتنسيق مع مختلف القطاعات الحكومية، على تطوير المنصات الرقمية وفق معايير موحدة ترتكز على تحسين تجربة المرتفق، وتبسيط الولوج إلى الخدمات، والرفع من جودة الأداء وسرعة الاستجابة، مع احترام معايير الولوجية الرقمية لفائدة جميع الفئات.\n\nكما تواصل الوزارة تطوير البوابة الوطنية ""إدارتي"" باعتبار أنها ستكون نقطة الولوج الوطنية للمعلومات والخدمات العمومية الرقمية، وتعزيزها بالمرجع الوطني للخدمات العمومية الرقمية، بما يتيح للمرتفقين الولوج إلى الخدمات من خلال منصة موحدة وموثوقة.', 'Content: السادة النواب المحترمون\xa0\n\n- فريق الأصالة والمعاصرة  -\xa0\n\n-مجلس المستشارين-\xa0\n\n\u202f\xa0\n\nالموضوع: سؤالكم الآني حول تحسين جودة المنصات الرقمية العمومية \n\nالمرجـــع: سؤالكم الشفوي رقم 18024\n\n\u202f\xa0\n\n\u202f\xa0\n\nسلام تام بوجود مولانا الإمام،\xa0\n\n\u202fالسيد الرئيس المحترم،\u202f\xa0\n\nالسيدات والسادة النواب المحترمون،\n\nأشكركم على هذا السؤال الذي يهم تحسين جودة المنصات الرقمية العمومية، باعتباره أحد المرتكزات الأساسية للتحول الرقمي وتحسين جودة الخدمات العمومية.\n\nوفي هذا الإطار، تعمل الوزارة، بتنسيق مع مختلف القطاعات الحكومية، على تطوير المنصات الرقمية وفق معايير موحدة ترتكز على تحسين تجربة المرتفق، وتبسيط الولوج إلى الخدمات، والرفع من جودة الأداء وسرعة الاستجابة، مع احترام معايير الولوجية الرقمية لفائدة جميع الفئات.\n\nكما تواصل الوزارة تطوير البوابة الوطنية ""إدارتي"" باعتبارها نقطة الولوج الوطنية للمعلومات والخدمات العمومية الرقمية، و العمل على تعزيزها بالمرجع الوطني للخدمات العمومية الرقمية، بما يتيح للمرتفقين الولوج إلى الخدمات من خلال منصة موحدة وموثوقة.']",تعتمد الوزارة مقاربة متكاملة تقوم على الانتقال من تعدد المنصات إلى توفير تجربة رقمية موحدة، ترتكز على توحيد مختلف الخدمات الرقمية التي تقدمها الإدارات العمومية.,"السادة المستشارون المحترمون
- فريق الاتحاد المغربي للشغل -
-مجلس المستشارون-
الموضوع: توحيد المنصات والخدمات الرقمية
المرجـــع: سؤالكم الشفوي رقم 10210
سلام تام بوجود مولانا الإمام،
السيد الرئيس المحترم،
أشكركم على هذا السؤال الذي يهم أحد الأوراش الأساسية للتحول الرقمي، والمتمثل في توحيد الولوج إلى الخدمات العمومية الرقمية وتحسين تجربة المرتفق.
وفي هذا الإطار، تعتمد الوزارة مقاربة متكاملة تقوم على الانتقال من تعدد المنصات إلى توفير تجربة رقمية موحدة، ترتكز على توحيد مختلف الخدمات الرقمية التي تقدمها الإدارات العمومية.
ولهذا الغرض، تعمل الوزارة على تطوير البوابة الوطنية للمساطر والإجراءات الإدارية ""إدارتي""، المنصوص عليها في المادة 26 من القانون رقم 55.19، لتكون نقطة الولوج الموحدة للخدمات العمومية الرقمية. فبعد أن شكلت مرجعًا رسميًا للمساطر والإجراءات الإدارية، يتم العملعلى  تعزيزها بإحداث المرجع الوطني للخدمات العمومية الرقمية الذي من المقرر أن  يضم اليوم من 600 خدمة رقمية، بما يتيح للمواطنين والمقاولات الولوج إلى مختلف الخدمات الإدارية الرقمية من خلال منصة واحدة وموثوقة.
كما تواصل الوزارة تطوير البوابة وفق مقاربة تتمحور حول المرتفق، من خلال اعتماد تصنيف للخدمات حسب أحداث الحياة، وإدماج محرك بحث ذكي ومساعد افتراضي يعتمد على تقنيات الذكاء الاصطناعي، إلى جانب فضاءات لتقييم الخدمات وتقديم الشكايات، مع احترام معايير الولوجية الرقمية لفائدة جميع الفئات.
وبموازاة ذلك، تعمل الوزارة على تطوير الحساب الرقمي للمرتفق والمحفظة الإلكترونية، وتعزيز التبادل البيني للمعطيات بين الإدارات، بما سيمكن المرتفق مستقبلاً من الولوج إلى مختلف الخدمات العمومية الرقمية وإنجاز إجراءاته الإدارية عبر فضاء رقمي موحد وآمن، مع ضمان احترام مقتضيات الأمن السيبراني وحماية المعطيات ذات الطابع الشخصي.
وستواصل الوزارة، بتنسيق مع مختلف القطاعات الحكومية، هذا الورش بشكل تدريجي، بما يجعل من بوابة ""إدارتي"" نقطة الولوج الوطنية الموحدة للخدمات العمومية الرقمية، ويعزز جودة الخدمات، وييسر ولوج المرتفقين.
والسلام عليكم ورحمة الله وبركاته",1.0,0.8703508724382224,0.9999999999666667,
اإلدارة بلا زمان وبلا مكان,"['Content: مجلس المستشارين\n\nفريق الاتحاد المغربي للشغل\n\n الرباط  في 23/02/2026\n\nالرقم:10220\n\nالموضوع: سؤال شفوي\n\nالإدارة بلا زمان وبلا مكان\n\nالسيد الرئيس المحترم،\n\nالسيدات والسادة المستشارون المحترمون،\n\nأشكركم على هذا السؤال المتعلق بالخطوات المتخذة لتحقيق إدارة بلا زمان، من خلال توفير الخدمات على مدار الساعة، وإدارة بلا مكان، عبر تمكين المواطنين والمستثمرين من الولوج إلى الخدمات العمومية عن بعد، وضمان فعاليتها في مختلف مناطق المملكة، بما فيها المناطق النائية والقروية.\n\nوفي هذا الإطار، تعمل الوزارة، بتنسيق مع مختلف القطاعات الحكومية، على مواصلة رقمنة الخدمات العمومية وتطوير البوابة الوطنية للمساطر والإجراءات الإدارية ""إدارتي""، باعتبارها مرجعاً وطنياً للمعلومات المتعلقة بالمساطر والإجراءات الإدارية، يتيح للمرتفقين الولوج إلى معلومات رسمية وموثوقة حول مختلف الخدمات الإدارية.', 'Content: وفي هذا السياق، فقد تم إصدار المرسوم رقم 2.17.265 بتاريخ 29 يونيو2017 المتعلق بتحديد كيفيات تلقي ملاحظات المرتفقين واقتراحاتهم وشكاياتهم وتتبعها ومعالجتها، والذي يهم إدارات الدولة والمؤسسات العمومية وكل شخص اعتباري يمارس صلاحيات السلطة العمومية ويحدد مسطرة تلقي الشكاية وتتبعها ومعالجتها وآجال الرد عليها.\n\nوتنزيلا لمقتضيات المرسوم المذكور، فقد تم إطلاق البوابة الوطنية الموحدة للشكايات chikaya.ma بتاريخ 9 يناير 2018 برئاسة السيد رئيس الحكومة، حيث تم وضع منظومة متكاملة لتسهيل عملية تقديم الشكايات وإبداء الملاحظات والاقتراحات حول الخدمات العمومية المقدمة للمرتفقين، وذلك من خلال إمكانية التواصل مع المسؤولين بالإدارات العمومية من أي مكان وعلى مدار الساعة، وإتاحة خاصية تتبع الشكايات والاطلاع على الردود المقدمة من الإدارات المعنية.هذا فضلا عن إمكانية إعادة فتح الشكاية في حالة عدم الرضا عن الإجابة المتوصل بها وكذلك توفير نظام تقييم للخدمات، يسمح للمواطنين بإبداء آرائهم حول جودة المعالجة.', 'Content: وتنزيلا لمقتضيات المرسوم المذكور، فقد تم إطلاق البوابة الوطنية الموحدة للشكايات chikaya.ma بتاريخ 9 يناير 2018 برئاسة السيد رئيس الحكومة، حيث تم وضع منظومة متكاملة لتسهيل عملية تقديم الشكايات وإبداء الملاحظات والاقتراحات حول الخدمات العمومية المقدمة للمرتفقين، وذلك من خلال إمكانية التواصل مع المسؤولين بالإدارات العمومية من أي مكان وعلى مدار الساعة، كما وضعت الوزارة رهن إشارة المرتفقين مركز الاتصال والتوجيه الإداري لتوجيههم في هذا الشأن، وتذليل المشاكل التي تعترضهم في عملية إيداع وتتبع الشكايات، وتجدر الإشارة أن جميع الإدارات التي تخضع لمقتضيات المرسوم منخرطة بهذه البوابة، بما فيها القطاعات الوزارية بما مجموعه 40 قطاعا وزاريا، والمؤسسات والمقاولات العمومية بما مجموعه 119 مؤسسة وكذا الجماعات الترابية بما مجموعه 1590 جماعة.']",تتمثل إدارة بلا زمان وبلا مكان في توفير الخدمات على مدار الساعة، وتمكين المواطنين والمستثمرين من الولوج إلى الخدمات العمومية عن بعد، وضمان فعاليتها في مختلف مناطق المملكة، بما فيها المناطق النائية والقروية.,"مجلس المستشارين
فريق الاتحاد المغربي للشغل
الرباط  في 23/02/2026
الرقم:10220
الموضوع: سؤال شفوي
الإدارة بلا زمان وبلا مكان
السيد الرئيس المحترم،
السيدات والسادة المستشارون المحترمون،
أشكركم على هذا السؤال المتعلق بالخطوات المتخذة لتحقيق إدارة بلا زمان، من خلال توفير الخدمات على مدار الساعة، وإدارة بلا مكان، عبر تمكين المواطنين والمستثمرين من الولوج إلى الخدمات العمومية عن بعد، وضمان فعاليتها في مختلف مناطق المملكة، بما فيها المناطق النائية والقروية.
وفي هذا الإطار، تعمل الوزارة، بتنسيق مع مختلف القطاعات الحكومية، على مواصلة رقمنة الخدمات العمومية وتطوير البوابة الوطنية للمساطر والإجراءات الإدارية ""إدارتي""، باعتبارها مرجعاً وطنياً للمعلومات المتعلقة بالمساطر والإجراءات الإدارية، يتيح للمرتفقين الولوج إلى معلومات رسمية وموثوقة حول مختلف الخدمات الإدارية.
كما تعمل الوزارة على استكمال تطوير النسخة الجديدة من البوابة، المزمع إطلاقها قريباً، والتي ستتضمن المرجع الوطني للخدمات العمومية الرقمية (e-Services)، باعتباره نقطة ولوج موحدة إلى الخدمات العمومية الرقمية، بما ييسر على المواطنين والمقاولات والمستثمرين الوصول إلى مختلف الخدمات الحكومية الإلكترونية من خلال منصة واحدة.
وبالموازاة مع ذلك، تواصل الوزارة تطوير مشاريع مهيكلة، من بينها الحساب الرقمي للمرتفق والمحفظة الإلكترونية، إلى جانب تعزيز التبادل البيني للمعطيات بين الإدارات، بما يمكن من إنجاز الإجراءات الإدارية وتتبعها عن بعد، وتقليص الحاجة إلى التنقل إلى المرافق الإدارية.
ولضمان فعالية هذه الخدمات واستمرارية الولوج إليها، تعتمد الوزارة أحدث التقنيات الرقمية، بما في ذلك محرك بحث ذكي ومساعد افتراضي يعتمد على الذكاء الاصطناعي، مع احترام معايير الولوجية الرقمية، وتعزيز الأمن السيبراني وحماية المعطيات ذات الطابع الشخصي، بما يضمن استفادة جميع المواطنات والمواطنين، بما في ذلك ساكنة المناطق القروية والنائية، من خدمات عمومية رقمية ذات جودة.
والسلام عليكم ورحمة الله تعالى وبركاته.",1.0,0.8894871106340341,0.9999999999666667,
استيعاب أكبر عدد من المرتفقين بكفاءة عالية,"['Content: السادة المستشارون المحترمون\xa0\n\n- فريق الاتحاد المغربي للشغل  -\xa0\n\n-مجلس المستشارين-\xa0\n\n\u202f\xa0\n\nالموضوع: سؤالكم العادي حول استيعاب أكبر عدد من المرتفقين بكفاءة عالية\n\nالمرجـــع: سؤالكم الشفوي رقم 10224\n\n\u202f\xa0\n\nسلام تام بوجود مولانا الإمام،\xa0\n\n\u202fالسيد الرئيس المحترم،\u202f\xa0\n\nالسيدات والسادة المستشارون المحترمون،\n\nأشكركم على هذا السؤال الذي يهم ضمان قدرة المنصات الرقمية العمومية على استيعاب الأعداد المتزايدة من المرتفقين، وتقديم خدمات ذات جودة، بما ييسر الولوج إلى الخدمات العمومية ويجنب المرتفقين الازدحام وطول فترات الانتظار.\n\nوفي هذا الإطار، تعمل الوزارة، بتنسيق مع مختلف القطاعات الحكومية، على تحديث وتطوير المنصات الرقمية العمومية وفق أحدث المعايير التقنية، بما يضمن قدرتها على استيعاب عدد كبير من المرتفقين في الوقت نفسه، مع الحفاظ على سرعة الاستجابة واستمرارية الخدمة، خاصة خلال فترات ارتفاع الإقبال.', 'Content: تكوين الموارد البشرية لضمان حسن استيعاب هذه الأدوات، حيث تم تنظيم أكثر من 1750 دورة تكوينية لفائدة أزيد من 52.755 موظفا وموظفة، فضلا عن تكوين 464 موظفا من 105 إدارة على تدبير مصنفات القرارات الإدارية؛\n\nتقوية آليات الحكامة عبر شبكة سفراء الحكومة الإلكترونية والرقمنة ""رائد""، التي تضم ممثلين عن مختلف القطاعات لتتبع الالتزامات والتذكير المستمر بمبادئ القانون، إلى جانب إطلاق جائزة ""ريادة"" لتحفيز الإدارات على تبني أفضل الممارسات الرقمية.\n\nوتظل الوزارة ملتزمة بمواصلة هذه الجهود وتسريع وتيرتها، عبر تعميم مقاربة ""مسار المرتفق"" على مزيد من القطاعات، واستكمال الترسانة القانونية والتنظيمية، وتعزيز آليات التتبع والتقييم بمؤشرات قابلة للقياس، حتى يتحقق الأثر المنتظر على ثقة المواطنين والمستثمرين، وعلى تحسين مناخ الأعمال وجاذبية الاستثمار بالمغرب.', 'Content: ثالثا: مواكبة الإدارات في قياس النضج الرقمي لسجلاتها الإدارية: عملت الوزارة في هذا الصدد على وضع إطار لقياس النضج الرقمي للسجلات البيانات الإدارية، سيمكن الإدارات المعنية من تحديد مكامن الخلل ووضع الاحتياطات والتطويرات المناسبة للرفع من جاهزيتها الرقمية قصد توفير بيانات ذات مصداقية وموثوقية وجودة عالية ومحمية من أجل تبادلها بين الإدارات في إطار الخدمات التي تقدم للمواطنين والمقاولات وذلك في إطار الاحترام التام للتشريعات ذات الصلة بمعالجة المعطيات ذات الطابع الشخصي والأمن السبيراني. \n\n\t\tرابعا : بالإضافة إلى ما سبق، تعمل الوزارة حاليا، وفي إطار تنزيل محاور إستراتيجية المغرب الرقمي 2030، وبشراكة مع مختلف المتدخلين، على برمجة مجموعة من العمليات من أجل مواكبة الإدارات العمومية في تطوير الاعتماد على خدمات الثقة في التعاملات الإدارية قصد تطوير وتنويع اليات حماية البيانات وتعزيز الأمن السيبراني.']",تعمل الوزارة على تحديث وتطوير المنصات الرقمية العمومية لضمان استيعاب أكبر عدد من المرتفقين بكفاءة عالية، وتقديم خدمات ذات جودة، وتوفير قدرة على استيعاب عدد كبير من المرتفقين في الوقت نفسه، مع الحفاظ على سرعة الاستجابة واستمرارية الخدمة.,"السادة المستشارون المحترمون
- فريق الاتحاد المغربي للشغل  -
-مجلس المستشارين-
الموضوع: سؤالكم العادي حول استيعاب أكبر عدد من المرتفقين بكفاءة عالية
المرجـــع: سؤالكم الشفوي رقم 10224
سلام تام بوجود مولانا الإمام،
السيد الرئيس المحترم،
السيدات والسادة المستشارون المحترمون،
أشكركم على هذا السؤال الذي يهم ضمان قدرة المنصات الرقمية العمومية على استيعاب الأعداد المتزايدة من المرتفقين، وتقديم خدمات ذات جودة، بما ييسر الولوج إلى الخدمات العمومية ويجنب المرتفقين الازدحام وطول فترات الانتظار.
وفي هذا الإطار، تعمل الوزارة، بتنسيق مع مختلف القطاعات الحكومية، على تحديث وتطوير المنصات الرقمية العمومية وفق أحدث المعايير التقنية، بما يضمن قدرتها على استيعاب عدد كبير من المرتفقين في الوقت نفسه، مع الحفاظ على سرعة الاستجابة واستمرارية الخدمة، خاصة خلال فترات ارتفاع الإقبال.
كما تواصل الوزارة رقمنة الخدمات العمومية وتطوير البوابة الوطنية للمساطر والإجراءات الإدارية ""إدارتي""، واستكمال النسخة الجديدة منها، المزمع إطلاقها قريبًا، والتي ستتضمن المرجع الوطني للخدمات العمومية الرقمية (e-Services)، بهدف تمكين المواطنين والمقاولات من الولوج إلى مختلف الخدمات الرقمية عبر نقطة ولوج موحدة، بما يسهل الوصول إليها، ويقلص الحاجة إلى التنقل، ويخفف الضغط على شبابيك الاستقبال بالإدارات.
وبالموازاة مع ذلك، تعمل الوزارة على تطوير الحساب الرقمي للمرتفق والمحفظة الإلكترونية، وتعزيز التبادل البيني للمعطيات بين الإدارات، بما يتيح إنجاز الإجراءات الإدارية عن بعد، ويختصر آجال المعالجة، ويُحسن تجربة المرتفق، ويضمن انسيابية أكبر في تقديم الخدمات.
ولضمان استدامة هذه المكتسبات، تحرص الوزارة على المراقبة المستمرة لأداء المنصات الرقمية، وتعزيز جاهزيتها، واعتماد أعلى معايير الأمن السيبراني وحماية المعطيات ذات الطابع الشخصي، بما يضمن خدمات رقمية موثوقة، فعالة، وقادرة على الاستجابة لتزايد الطلب وتحقيق تطلعات المرتفقين.
والسلام عليكم ورحمة الله تعالى وبركاته.",1.0,0.806911778583487,0.99999999995,
تطوير وتعميم البوابة الوطنية الموحدة للخدمات الادارية,"['Content: السادة المستشارون المحترمون\xa0\n\n- الفريق الاستقلالي للوحدة والتعادلية -\xa0\n\n-مجلس المستشارون-\xa0\n\n\u202f\xa0\n\nالموضوع: سؤالكم الآني حول تطوير وتعميم البوابة الوطنية الموحدة للخدمات الإدارية idarati .\xa0\xa0\n\nالمرجـــع: سؤالكم الشفوي رقم 10763\n\n\u202f\xa0\n\n\u202f\xa0\n\nسلام تام بوجود مولانا الإمام،\xa0\n\n\u202fالسيد الرئيس المحترم،\u202f\xa0\n\nالسيدات والسادة المستشارون المحترمون،\xa0نشكركم على هذا السؤال الذي يهم ورشًا استراتيجيًا يندرج في إطار تنزيل مقتضيات القانون رقم 55.19 المتعلق بتبسيط المساطر والإجراءات الإدارية، ولاسيما المادة 26 منه، التي نصت على إحداث البوابة الوطنية للمساطر والإجراءات الإدارية.\n\nوقد عملت الوزارة على تطوير بوابة ""إدارتي"" باعتبارها منصة وطنية موحدة تمكن المرتفقين من الولوج إلى المعلومات المتعلقة بالمساطر والإجراءات الإدارية والخدمات العمومية الرقمي مما يعزز الشفافية وييسر الولوج إلى الخدمات العمومية.', 'Content: 2. ومن جهة أخرى، يجري حالياً تطوير البوابة الوطنية بهدف إثرائها بخصائص وظيفية جديدة تعتمد على مقاربة ترتكز على المسار الإداري في تبسيط المساطر ورقمنتها، مع تطبيق الممارسات الدولية الفضلى والقياس المستمر لرضا المرتفقين، واعتماد بوابة موحدة للإدارة الرقمية. وفي مرحلة أولى، سيتم إطلاق البوابة الوطنية للخدمات الرقمية من خلال إنشاء المرجع الوطني للخدمات العمومية الرقمية، والذي يضم أكثر من 600 خدمة إلكترونية. وقد تم تصميم هذه البوابة الموحدة لتجميع وتصنيف وتسهيل وصول المرتفقين إلى مختلف الخدمات العمومية المتاحة عبر الإنترنت، مع تمكينهم من الولوج إليها وفق أحداث الحياة، وتعزيز التفاعل من خلال وسائل تقديم الملاحظات والاقتراحات. وتُعتبر هذه البوابة نقطة ولوج وحيدة محددة وموثوقة لجميع الخدمات العمومية عبر الإنترنت، كما تشكل نافذة عرض وظيفية لكل إدارة لعرض خدماتها والتفاعل مع تعليقات المرتفقين حول رضاهم عن استخدام الخدمات الإدارية الإلكترونية', 'Content: ولهذا الغرض، تعمل الوزارة على تطوير البوابة الوطنية للمساطر والإجراءات الإدارية ""إدارتي""، المنصوص عليها في المادة 26 من القانون رقم 55.19، لتكون نقطة الولوج الموحدة للخدمات العمومية الرقمية. فبعد أن شكلت مرجعًا رسميًا للمساطر والإجراءات الإدارية، يتم العملعلى  تعزيزها بإحداث المرجع الوطني للخدمات العمومية الرقمية الذي من المقرر أن  يضم اليوم من 600 خدمة رقمية، بما يتيح للمواطنين والمقاولات الولوج إلى مختلف الخدمات الإدارية الرقمية من خلال منصة واحدة وموثوقة.\n\nكما تواصل الوزارة تطوير البوابة وفق مقاربة تتمحور حول المرتفق، من خلال اعتماد تصنيف للخدمات حسب أحداث الحياة، وإدماج محرك بحث ذكي ومساعد افتراضي يعتمد على تقنيات الذكاء الاصطناعي، إلى جانب فضاءات لتقييم الخدمات وتقديم الشكايات، مع احترام معايير الولوجية الرقمية لفائدة جميع الفئات.']","تطوير وتعميم البوابة الوطنية الموحدة للخدمات الإدارية ""إدارتي"" يتم من خلال إحداث المرجع الوطني للخدمات العمومية الرقمية، الذي يضم أكثر من 600 خدمة إلكترونية، وتعزيز البوابة بخصائص وظيفية جديدة تعتمد على مقاربة ترتكز على المسار الإداري، وتطبيق الممارسات الدولية الفضلى، والقياس المستمر لرضا المرتفقين، واعتماد بوابة موحدة للإدارة الرقمية.","السادة المستشارون المحترمون
- الفريق الاستقلالي للوحدة والتعادلية -
-مجلس المستشارون-
الموضوع: سؤالكم الآني حول تطوير وتعميم البوابة الوطنية الموحدة للخدمات الإدارية idarati .
المرجـــع: سؤالكم الشفوي رقم 10763
سلام تام بوجود مولانا الإمام،
السيد الرئيس المحترم،
السيدات والسادة المستشارون المحترمون، نشكركم على هذا السؤال الذي يهم ورشًا استراتيجيًا يندرج في إطار تنزيل مقتضيات القانون رقم 55.19 المتعلق بتبسيط المساطر والإجراءات الإدارية، ولاسيما المادة 26 منه، التي نصت على إحداث البوابة الوطنية للمساطر والإجراءات الإدارية.
وقد عملت الوزارة على تطوير بوابة ""إدارتي"" باعتبارها منصة وطنية موحدة تمكن المرتفقين من الولوج إلى المعلومات المتعلقة بالمساطر والإجراءات الإدارية والخدمات العمومية الرقمي مما يعزز الشفافية وييسر الولوج إلى الخدمات العمومية.
وقد تم إطلاق النسخة الأولى للبوابة سنة 2021، وتضم اليوم حوالي 2500 قرار إداري يهم أكثر من 120 إدارة، كما يتم العمل على إحداث المرجع الوطني للخدمات العمومية الرقمية  e-services الذي من المقرر أن يضم أزيد من 600 خدمة رقمية وتعزيزها بمحرك بحث ذكي، ومساعد افتراضي يعتمد على تقنيات الذكاء الاصطناعي، مع احترام معايير الولوجية الرقمية لفائدة جميع الفئات.
أما بخصوص جعلها الشباك الوحيد للمواطن، فتواصل الوزارة، بتنسيق مع مختلف الإدارات، تطوير البوابة بشكل تدريجي من خلال إدماج المزيد من الخدمات الرقمية، وتعزيز التبادل البيني بين الإدارات، وتطوير مشروع الحساب الرقمي للمرتفق والمحفظة الإلكترونية، بما يمكن مستقبلاً من إنجاز مختلف الإجراءات الإدارية عبر نقطة ولوج وطنية موحدة وآمنة، في احترام تام لمقتضيات حماية المعطيات ذات الطابع الشخصي وأمن نظم المعلومات.
والسلام عليكم ورحمة الله تعالى وبركاته.",,0.9415055434953481,0.9999999999666667,
" التصور الحكومي بشأن معالجة إشكالية تبسيط المساطر الإدارية المتعلقة بالبرامج المستهدفة
للشباب إنجاحا لمشاريعهم و إسهاماتهم في الإقلاع الاقتصادي و الاجتماعي لبلادنا ؟","['Content: وفي هذا السياق، يندرج التصور الحكومي لمعالجة إشكالية تبسيط المساطر الإدارية المرتبطة بالبرامج الموجهة للشباب، في إطار مقاربة شمولية تهدف إلى تيسير إنجاز مشاريعهم، وتحفيز روح المبادرة، وتمكينهم من الاندماج الاقتصادي والاجتماعي، باعتبارهم ركيزة أساسية لتحقيق الإقلاع الاقتصادي والاجتماعي لبلادنا.\n\nمشروع تبسيط مسار إنشاء دور الحضانة الذي سبق ذكره\n\nتبسيط القرارات الإدارية التي تُدرس على مستوى اللجان الجهوية الموحدة للاستثمار\n\nإضافة إلى ذلك، عملت الوزارة، بتنسيق مع القطاعات المعنية، على تبسيط المساطر المرتبطة بالقرارات الإدارية اللازمة لإنجاز مشاريع الاستثمار، من خلال تنظيم ورشات عمل شملت 22 قرارًا إداريًا تُدرس على مستوى اللجان الجهوية الموحدة للاستثمار. وقد صادقت اللجنة الوطنية للمساطر والإجراءات الإدارية على الصيغ الجديدة لهذه المساطر في فبراير 2023، مما أسفر عن تقليص الوثائق المطلوبة من المستثمرين بنسبة 45% وتسريع آجال إعداد ملفات الطلبات. كما تم تحيين منصة CRI-INVEST وإطلاق الصيغ المبسطة عبرها.', 'Content: وفي هذا السياق، يندرج التصور الحكومي لمعالجة إشكالية تبسيط المساطر الإدارية المرتبطة بالبرامج الموجهة للشباب، في إطار مقاربة شمولية تهدف إلى تيسير إنجاز مشاريعهم، وتحفيز روح المبادرة، وتمكينهم من الاندماج الاقتصادي والاجتماعي، باعتبارهم ركيزة أساسية لتحقيق الإقلاع الاقتصادي والاجتماعي لبلادنا.\n\nمشروع تبسيط مسار إنشاء دور الحضانة\n\nبالتعاون مع وزارة الشباب، يجري العمل على تبسيط ورقمنة المساطر الإدارية المرتبطة بإنشاء دور الحضانة. هذا المشروع يهدف إلى تسهيل الاستثمار في هذا القطاع، مما يفتح المجال أمام الشباب لخلق مشاريعهم الخاصة وتوفير فرص عمل جديدة في هذا المجال. فهذه الخطوة ستساهم في تشجيع الاستثمار في قطاع التربية المبكرة، الذي يُعتبر قطاعاً واعداً يمكن أن يكون رافعة قوية للتشغيل.\n\nمشروع تبسيط ورقمنة مسار الترشح الحر لنيل شهادة البكالوريا', 'Content: الموضوع : سؤال كتابي بشأن تحديات رقمنة الإدارة ببلادنا  وسبل معالجتها\n\nالمرجع: سؤال كتابي لجبهة القوى الديمقراطية بمجلس النواب رقم24950 بتاريخ06  أكتوبر2025.\n\n   \n\n                       سلام تام بوجود مولانا الإمام، \n\n    \n\n         وبعد، أود في البداية أن أشكر السيدة النائبة المحترمة، عن جبهة القوى الديمقراطية، على طرحها هذا السؤال و اهتمامها بهذا الموضوع الذي يندرج ضمن أهم الإجراءات التي جاء بها البرنامج الحكومي(2026-2021) تماشيا مع توجيهات صاحب الجلالة نصره الله، الذي دعا لرقمنة الخدمات العمومية، من أجل توفير الخدمات العمومية بشكل بسيط و سهل و شفاف بما يستجيب لحاجيات وتطلعات المرتفقين.']",التصور الحكومي لمعالجة إشكالية تبسيط المساطر الإدارية المرتبطة بالبرامج الموجهة للشباب يندرج في إطار مقاربة شمولية تهدف إلى تيسير إنجاز مشاريعهم، وتحفيز روح المبادرة، وتمكينهم من الاندماج الاقتصادي والاجتماعي. وتشمل هذه المقاربة مشاريع مثل تبسيط مسار إنشاء دور الحضانة وتبسيط القرارات الإدارية التي تُدرس على مستوى اللجان الجهوية الموحدة للاستثمار.,"السيد الرئيس المحترم،
السيدات والسادة النواب المحترمون،
يشكل تبسيط المساطر الإدارية وقمنة الخدمات العمومية، إحدى أولويات الحكومة في إطار سعيها إلى تعزيز مناخ الأعمال، وتحسين جودة الخدمات المقدمة للمواطنين، خاصة الشباب الذين يُعتبرون ركيزة أساسية في التنمية الاقتصادية والاجتماعية لبلادنا. فالتعقيد الإداري والإجراءات المطولة لطالما شكلا عائقاً أمام طموحات الشباب، سواء في ولوج سوق الشغل، أو في تأسيس مشاريعهم الخاصة والاستفادة من الفرص المتاحة لهم.
ولهذا، تعمل الحكومة، تنفيذاً للتوجيهات الملكية السامية، على تسريع وتيرة الإصلاحات الرامية إلى تبسيط ورقمنة المساطر الإدارية، تماشياً مع مقتضيات القانون رقم 55.19 المتعلق بتبسيط المساطر والإجراءات الإدارية. ويهدف هذا الورش الإصلاحي إلى تقليص عدد الوثائق المطلوبة، تقليل آجال المعالجة، إلغاء أي تعقيدات غير مبررة، وتعزيز مبدأ الشفافية في التعاملات الإدارية، مما يسهل ولوج الشباب إلى مختلف البرامج الداعمة لمشاريعهم، سواء في مجال ريادة الأعمال أو التشغيل أو التكوين.
وفي هذا السياق، تعمل على تنسيق الجهود الرامية لتنزيل ورش رقمنة الإدارة وفق هذه الرؤية وذلك عبر عدة محاور منها:
أولا: مواكبة الإدارات في تبسيط ورقمنة مسارات المرتفق:
من خلال دعم ومواكبة مجموعة من القطاعات الوزارية في تبسيط ورقمنة خدماتها وتحولها الرقمي، و من أبرزها:
رقمنة مسار الترشيح الحر للباكالوريا بشكل جذري ورقمتنه عبر إطلاق البوابة الوطنية للتسجيل الحر في الباكالوريا، بوابة إلكترونية موحدة توفر جميع المعلومات والخدمات المرتبطة بالتسجيل.
مكنت عملية التبسيط هذه إلى خفض :
ـ الوقت المستغرق للترشيح من يومين إلى أقل من 20 دقيقة
ـ عدد الوثائق المطلوبة من 18 وثيقة إلى 0 وثيقة
ـ عدد التنقلات من6 إلى 0، حيث أن الخدمة أصبحت 100% عبر الأنتيرنيت، رمزا للثقة بين المواطن و الإدارة
في هذا النطاق، ساهمت وزارة الانتقال الرقمي وإصلاح الإدارة في تقديم الدعم لقطاع التربية الوطنية على تطبيق المنهجية الوطنية لتبسيط المساطر وتهيئة رقمنتها. كما أنها ساهمت في مجهودات تقييم أثر التبسيط والإعلام عن إطلاق هذه البوابة من خلال تصميم مقاطع فيديو تشرح فائدة البوابة الجديدة وتسهل على المترشحين الوصول إلى الخدمة بسهولة. وأخيرًا، ساهمت الوزارة في مساعدة وإرشاد المستخدمين و مواكبتهم من خلال إتاحة فرق المركز الوطني للمعلومات والإرشادات للمواطنين 3737 لهذه العملية.
دعم قطاع الاستثمار في تبسيط ورقمنة مجموعة من المسارات ذات الأولوية للمستثمرين في إطار الإجراءات الاستعجالية ذات الأولوية الرامية إلى تحسين مناخ الأعمال ودعم تنافسية الاقتصاد الوطني؛ وعلاقة بالقرارات الإدارية اللازمة لإنجاز مشاريع الاستثمار بتنسيق مع وزارة الاستثمار
والتلقائية وتقييم السياسات العمومية ومختلف الشركاء.
ثانيا: تصميم وتطوير البوابات المشتركة:
كالمرجع الوطني للخدمات العمومية الرقمية، الذي تم إنشاؤها بالاشتراك مع مجموع القطاعات الوزارية، بهدف تجميع روابط مختلف الخدمات العمومية المتاحة عبر الانترنيت وتسهيل وصول المرتفقين إليها. والذي يضم أكثر من   600خدمة رقمية. والمشروع في مراحله الأخيرة وسيتم إطلاقه في أقرب الآجال.
يهدف هذا المرجع لتحسين إبراز الخدمات العامة المتاحة وقياس مدى رضا المستخدمين وتوفير تجربة سلسة للمستخدمين ونقطة دخول واحدة إلى مجموعة من الخدمات عبر الإنترنت. من بين ميزاتها الرئيسية، تقدم البوابة تجربة تتمحور حول المستخدم مع معلومات عملية لكل احتياجات المستخدم، وأفضل الممارسات في الشمولية وتيسير الوصول، وقناة استماع لجمع آراء المستخدمين.
وتشتغل الوزارة، بتنسيق مع مختلف الشركاء، على ملاءمة الخدمات الرقمية المقدمة مع مقتضيات القانون رقم 09.08 المتعلق بحماية الأشخاص الذاتيين تجاه معالجة المعطيات ذات الطابع الشخصي.
وفي هذا الإطار، بلغت نسبة المسارات الرقمية الملائمة مع هذا القانون حوالي 50%، وهو ما يعادل أزيد من 120 خدمة رقمية خضعت لعمليات المطابقة القانونية والتنظيمية، من حيث تدبير المعطيات الشخصية، وضمان أمنها، واحترام حقوق المرتفقين.
وتواصل الوزارة جهودها الرامية إلى تعميم هذه الملاءمة القانونية على مجموع الخدمات الرقمية، في إطار مقاربة تدريجية تأخذ بعين الاعتبار خصوصيات كل قطاع، وتعزز الثقة في الخدمات العمومية الرقمية.
كما تعمل الوزارة على التطوير المستمر لبوابة إداراتي من حيث المحتوى وجودة المعطيات، حيث تشتغل حالياً على مشروع هيكلة وتوحيد نموذج معطيات المساطر والقرارات الإدارية، بهدف بناء قاعدة بيانات منسجمة، دقيقة وقابلة للتطور.
ويروم هذا المشروع إعادة تنظيم المعطيات الإدارية وفق نموذج بيانات موحد يتيح تحسين جودة المعلومة، وتسهيل استغلالها، وإجراء تحليلات واستعلامات متقدمة، مع تمكين التطبيق الآلي لقواعد تبسيط المساطر الإدارية.
كما يهدف المشروع إلى تهيئة البنية المعطياتية اللازمة لتطوير روبوت محادثة ذكي (Chatbot) قادر على استثمار المعطيات المتاحة على بوابة إداراتي، وتقديم إجابات دقيقة وموثوقة للمرتفقين، بما يعزز الولوج إلى المعلومة الإدارية ويحسن تجربة الاستعمال.
ويتم تنزيل هذا الورش وفق مقاربة تدريجية وتشاركية تجمع بين الفرق التقنية وفرق المهن، بما يضمن ملاءمة النموذج المقترح مع الحاجيات الوظيفية، وقابليته للتطوير مستقبلاً، واستدامته كرافعة أساسية للتحول الرقمي للإدارة.
ثالثا: مواكبة النضج الرقمي للإدارات العمومية،
حيث عملت الوزارة على إعداد الإطار المرجعي لقياس نضج سجلات البيانات الإدارية لتسريع تنزيل ورش تبادل البيانات وتواكب الإدارات على اعتماده وتحديد الإجراءات اللازمة لتطوير سجلاتها.
بالإضافة إلى إصدار مجموعة من الدعامات المنهجية: كدليل تبسيط المسارات والتحضير لرقمنتها ودليل إدارة التغيير، ودليل الاستماع للمرتفقين.
رابعا: إرساء بيئة ملائمة للإدارة الإلكترونية: عبر إغناء الجانب القانوني والتنظيمي، حيث عملت بتنسيق مع مختلف الشركاء على إنجاز مجموعة من النصوص القانونية،
مشاريع مراسيم تطبيقية للقانون رقم 19-55 المتعلق بتبسيط المساطر والإجراءات الإدارية، وهي قيد المصادقة.
مشروع قانون بشأن رقمنة الخدمات الإدارية وهو قيد مسطرة المصادقة.
كمشروع مرسوم بشأن التبادل الإلكتروني بين الإدارات للوثائق والمستندات الإدارية،
مشروع مرسوم حول المعطيات العمومية المفتوحة
وفي السياق نفسه، أطلقت الوزارة مشروع إنجاز استبيانات دورية لقياس مستوى رضا المرتفقين عن الخدمات الرقمية المقدمة، باعتبارها أداة أساسية لتحسين جودة الخدمات وتوجيه قرارات التطوير.
ويهدف هذا المشروع إلى ترسيخ المقاربة التشاركية، من خلال إشراك المرتفقين بشكل مباشر في تقييم الخدمات، ورصد انتظاراتهم واقتراحاتهم، واستثمار نتائج هذه الاستبيانات في تجويد المسارات الرقمية وتعزيز المشاركة المواطِنة في تطوير الإدارة الرقمية.
وانطلاقًا مما سبق عرضه بخصوص آليات تبسيط ورقمنة المساطر والخدمات الإدارية، وما تتيحه من تقليص للآجال، وتخفيف للأعباء الإدارية، وتحسين لولوج المرتفقين إلى الخدمات العمومية، فإن هذا الورش لا يقتصر فقط على تحديث الإدارة، بل يشكّل رافعة أساسية لدعم البرامج الحكومية الموجهة للشباب.
وفي هذا السياق، يندرج التصور الحكومي لمعالجة إشكالية تبسيط المساطر الإدارية المرتبطة بالبرامج الموجهة للشباب، في إطار مقاربة شمولية تهدف إلى تيسير إنجاز مشاريعهم، وتحفيز روح المبادرة، وتمكينهم من الاندماج الاقتصادي والاجتماعي، باعتبارهم ركيزة أساسية لتحقيق الإقلاع الاقتصادي والاجتماعي لبلادنا.
مشروع تبسيط مسار إنشاء دور الحضانة
بالتعاون مع وزارة الشباب، يجري العمل على تبسيط ورقمنة المساطر الإدارية المرتبطة بإنشاء دور الحضانة. هذا المشروع يهدف إلى تسهيل الاستثمار في هذا القطاع، مما يفتح المجال أمام الشباب لخلق مشاريعهم الخاصة وتوفير فرص عمل جديدة في هذا المجال. فهذه الخطوة ستساهم في تشجيع الاستثمار في قطاع التربية المبكرة، الذي يُعتبر قطاعاً واعداً يمكن أن يكون رافعة قوية للتشغيل.
مشروع تبسيط ورقمنة مسار الترشح الحر لنيل شهادة البكالوريا
تم الانتهاء من تبسيط ورقمنة المساطر المتعلقة بالترشح لنيل شهادة البكالوريا الحرة، وذلك من خلال إلغاء عدد من الوثائق غير الضرورية واعتماد منصات إلكترونية تسهل العملية برمتها. يهدف هذا المشروع إلى تشجيع الشباب على متابعة مسارهم التعليمي والحصول على شهادة البكالوريا، التي تفتح لهم آفاقاً جديدة للاندماج في سوق الشغل، سواء عبر متابعة الدراسات العليا أو الالتحاق بتكوينات مهنية تؤهلهم للحصول على فرص عمل أفضل.
تبسيط القرارات الإدارية التي تُدرس على مستوى اللجان الجهوية الموحدة للاستثمار
إضافة إلى ذلك، عملت الوزارة، بتنسيق مع القطاعات المعنية، على تبسيط المساطر المرتبطة بالقرارات الإدارية اللازمة لإنجاز مشاريع الاستثمار، من خلال تنظيم ورشات عمل شملت 22 قرارًا إداريًا تُدرس على مستوى اللجان الجهوية الموحدة للاستثمار. وقد صادقت اللجنة الوطنية للمساطر والإجراءات الإدارية على الصيغ الجديدة لهذه المساطر في فبراير 2023، مما أسفر عن تقليص الوثائق المطلوبة من المستثمرين بنسبة 45% وتسريع آجال إعداد ملفات الطلبات. كما تم تحيين منصة CRI-INVEST وإطلاق الصيغ المبسطة عبرها.
ولضمان التنزيل الفعلي لهذه المساطر، تم تنظيم خرجات جهوية تحسيسية بجميع جهات المملكة لفائدة المصالح اللاممركزة المعنية.
وفي الإطار نفسه، تمت المصادقة على مجموعة من المراسيم التطبيقية للقانون رقم 55.19، نُشرت سنة 2023، من بينها مرسوم يهمّ لائحة القرارات الإدارية اللازمة لإنجاز مشاريع الاستثمار التي لا يتجاوز أجل معالجة الطلبات المتعلقة بها وتسليمها 30 يوما وعددها 311 قرارا إداريا. وقد تم تحيين هذه المراسيم ونشرت صيغها المعدلة بالجريدة الرسمية في فبراير 2025
ثلاثة أسئلة",1.0,,,
ما هي الإجراءات العملية التي تم اتخاذها لتبسيط المساطر الإدارية لفائدة مغاربة العالم ؟,"['Content: سؤال شفوي أني\xa0\xa0\n\n"" تبسيط المساطر الإدارية لفائدة مغاربة العالم   ""\xa0\n\nفريق الاصالة و المعاصرة\n\n\xa0\n\nرقم 12266\xa0\n\nمجلس المستشارين\xa022/11/2024\xa0\n\n\xa0\n\nالسيد الرئيس المحترم،\xa0\n\nالسيدات والسادة النواب المحترمون،\xa0\n\n\xa0 في البداية أوجه الشكر للسيد النائب المحترم، عن فريق الاصالة و المعاصرة، على طرح هذا السؤال واهتمامه بهذا الموضوع الذي يندرج ضمن أهم الإجراءات التي جاء بها البرنامج الحكومي (2026 – 2021) تماشيا مع توجيهات صاحب الجلالة نصره الله، الذي دعا الى رقمنة وتسريع الإجراءات والمساطر العمومية، من أجل توفير الخدمات العمومية بشكل بسيط وسهل وشفاف بما يستجيب لحاجيات وتطلعات المرتفقين.\xa0\xa0\n\nالموضوع الذي تجعله الوزارة على رأس أولوياتها ضمن رؤية استراتيجية المغرب الرقمي 2030 التي حظيت بالمباركة المولوية السامية. وعليه فإن الوزارة تعمل على تنسيق الجهود الرامية لتنزيل ورش رقمنة الإدارة وتسريع المساطر الإدارية وفق هذه الرؤية وذلك عبر عدة محاور منها:', 'Content: مواصلة تبسيط المساطر الإدارية باعتماد التبادل البيني للبيانات:\n\nفي إطار مواصلة الجهود الرامية لتحسين مناخ الأعمال بالمملكة، وحرصا على تيسير وتجويد الإجراءات الإدارية لفائدة المستثمرين، وتبعا لمخرجات ورشات العمل المخصصة لتبسيط 22 قرارا إداريا، تتم دراسة الطلبات المتعلقة بها على مستوى اللجان الجهوية الموحدة للاستثمار، والتي كللت بحذف 45% من الوثائق التي كانت تطلب من المستثمر، فقد تقرر مواصلة العمل على تبسيط القرارات الإدارية سالفة الذكر في إطار مرحلة ثانية سيتم خلالها تفعيل التبادل البيني لبعض الوثائق، من خلال دراسة إمكانية توفير المعطيات والمعلومات المتضمنة بها مباشرة من طرف الإدارات التي تصدرها. وقد تم في هذا الشأن عقد مجموعة من اللقاءات التشاورية الأولي\n\nتوسیع نطاق حالات استخدام المنصة الرقمية الخاصة بتبادل البيانات (Plateforme d’interopérabilité)', 'Content: بالإضافة إلى ما سبق، تعمل الوزارة بصفتها الكتابة الدائمة اللجنة الوطنية للتنمية الرقمية واللجنة الوطنية لتبسيط المساطر الإدارية على تتبع إنجاز الأوراش بتنسيق مع مختلف شركاءها لضمان نجاحها وتكاملها. كما تم أيضا العمل على إطلاق مبادرات تحفيزية متعددة، كإحداث شبكة سفراء الحكومة الإلكترونية والرقمنة ""رائد “وفق مقاربة تشاركية من أجل تشجيع التعاون بين مختلف القطاعات، ومشاركة أفضل الممارسات، وتشجيع تبادل الخبرات.\n\nبالإضافة إلى ما سبق، وفي إطار رؤية استراتيجية متكاملة تعمل الوزارة حالياً على إعداد حزمة أولية تضم أهم 100 خدمة عمومية (Top 100)، مع وضع برنامج عمل متكامل يشمل خطوات محورية مثل تبسيط الإجراءات الإدارية، رقمنة العمليات، تقديم المواكبة التقنية، توفير التكوين اللازم للموظفين، وضمان الدعم المالي اللازم لتنفيذ هذه المشاريع.\n\nومن أجل تعزيز جودة الخدمات العمومية، أعدت الوزارة كذلك دلائل إرشادية تُبرز الممارسات الفضلى التي يمكن للإدارات اتباعها لضمان تقديم خدمات إلكترونية فعّالة ومبسطة. كما تم إدراج برامج تكوين شاملة تهدف إلى رفع كفاءة الموارد البشرية وضمان استعدادها لتطبيق التحول الرقمي.']","تم اتخاذ عدة إجراءات عملية لتبسيط المساطر الإدارية لفائدة مغاربة العالم، منها:

1.  تبسيط المساطر الإدارية باعتماد التبادل البيني للبيانات.
2.  توسيع نطاق حالات استخدام المنصة الرقمية الخاصة بتبادل البيانات.
3.  إطلاق مبادرات تحفيزية متعددة، مثل شبكة سفراء الحكومة الإلكترونية والرقمنة.
4.  إعداد حزمة أولية تضم أهم 100 خدمة عمومية.
5.  وضع برنامج عمل متكامل يشمل خطوات محورية مثل تبسيط الإجراءات الإدارية، رقمنة العمليات، تقديم المواكبة التقنية، توفير التكوين اللازم للموظفين، وضمان الدعم المالي اللازم لتنفيذ هذه المشاريع.
6.  إعداد دلائل إرشادية تُبرز الممارسات الفضلى التي يمكن للإدارات اتباعها لضمان تقديم خدمات إلكترونية فعّالة ومبسطة.
7.  إدراج برامج تكوين شاملة تهدف إلى رفع كفاءة الموارد البشرية وضمان استعدادها لتطبيق التحول الرقمي.","السيد الرئيس المحترم،
السيدات والسادة النواب المحترمون،
في البداية أوجه الشكر للسيد النائب المحترم، عن فريق الاصالة و المعاصرة، على طرح هذا السؤال واهتمامه بهذا الموضوع الذي يندرج ضمن أهم الإجراءات التي جاء بها البرنامج الحكومي (2026 – 2021) تماشيا مع توجيهات صاحب الجلالة نصره الله، الذي دعا الى رقمنة وتسريع الإجراءات والمساطر العمومية، من أجل توفير الخدمات العمومية بشكل بسيط وسهل وشفاف بما يستجيب لحاجيات وتطلعات المرتفقين.
الموضوع الذي تجعله الوزارة على رأس أولوياتها ضمن رؤية استراتيجية المغرب الرقمي 2030 التي حظيت بالمباركة المولوية السامية. وعليه فإن الوزارة تعمل على تنسيق الجهود الرامية لتنزيل ورش رقمنة الإدارة وتسريع المساطر الإدارية وفق هذه الرؤية وذلك عبر عدة محاور منها:
أولا: مواكبة الإدارات في تبسيط ورقمنة مسارات المرتفق: من خلال دعم ومواكبة مجموعة من القطاعات الوزارية في تبسيط ورقمنة خدماتها وتحولها الرقمي، وعلى سبيل المثال:
تبسيط ورقمنة مسار الحصول على رخصة فتح واستغلال دور الحضانة، والذي يتضمن عشر 10 مساطر إدارية بتنسيق وطيد مع وزارة الشباب والثقافة والتواصل،
تبسيط ورقمنة مسار الحصول على دعم الدولة المتعلق بالضريبة على الشركات​ والضريبة على الدخل بالنسبة للشركات العاملة في مجال ترحيل الخدمات (Offshoring)
تبسيط ورقمنة مجموعة من المسارات ذات الأولوية للمستثمرين في إطار الإجراءات الاستعجالية ذات الأولوية الرامية إلى تحسين مناخ الأعمال ودعم تنافسية الاقتصاد الوطني؛ وعلاقة بالقرارات الإدارية اللازمة لإنجاز مشاريع الاستثمار بتنسيق مع وزارة الاستثمار والتقائية وتقييم السياسات العمومية ومختلف الشركاء.
مواكبة وزارة التربية الوطنية والتعليم الاولي والرياضة في تبسيط ورقمنة مساري ""الترشيح لامتحان الباكالوريا الحرة"" و""تسجيل الأطفال بالمدرسة""
مواكبة وزارة الصحة في تبسيط ورقمنة مجموعة من المسارات ذات الأولوية والمرتبطة بالورش الملكي المتعلق بتعميم الحماية الاجتماعية وإصلاح المنظومة الصحية.
وفي إطار مواصلة الجهود في تبسيط ورقمنة المساطر الإدارية، ومن أجل تعميم العمل على تبسيط مسارات المرتفقين، أعدت وزارة الانتقال الرقمي وإصلاح الإدارة دليلا منهجيا للتبسيط والإعداد لرقمنة مسارات المرتفقين لفائدة الإدارات العمومية، وقد تم وضع هذه المنهجية بالاعتماد على مقاربة تجريبية أثبتت فعاليتها من خلال نتائجها الملموسة لدى المرتفقين والتي تتجلى في تخفيض نسبة 45% من عدد الوثائق المطلوبة على مستوى الأوراش الأولى التي تم تنفيذها بها، وقد تم نشرها بالموقع الإلكتروني للوزارة بالقسم المتعلق ب"" الدلائل والإصدارات""، وسيتم التواصل بشأنه في مرحلة لاحقة.
ثانيا: إحداث المختبر الرقمي لوكالة التنمية الرقمية الذي يعتمد في اشتغاله على طرق مرنة من أجل مواكبة الإدارات في تصميم ورقمنة خدماتها الموجهة للعموم حيث عمل على إنجار ما يقارب 15 مشروعا في هذا الصدد.
ثالثا: تصميم وتنفيذ البوابات المشتركة:
كالبوابة الوطنية للمساطر والإجراءات الإدارية idarati.ma، والمرجع الوطني للخدمات العمومية الرقمية، الذي يهدف لتجميع وتصنيف مختلف الخدمات العمومية المتاحة عبر الانترنيت وتسهيل وصول المرتفقين إليها. والذي يضم أكثر من   600خدمة رقمية. والمشروع في مراحله الأخيرة وسيتم إطلاقه في أقرب الآجال.
بالإضافة إلى ذلك، تعمل الوزارة على تطوير وإغناء المنصة الوطنية للتبادل البيني والإعداد لإطلاق مشروع تصميم منصة الحساب الرقمي وذلك من أجل تسهيل تبادل البيانات بين الإدارات وتمكين المرتفقين من الولوج والاضطلاع عليها بغاية تبسيط المساطر والإجراءات الإدارية ورفع فعالية الإدارة.
رابعا: مواكبة النضج الرقمي للإدارات العموم،
حيث عملت الوزارة على إعداد الإطار المرجعي لقياس نضج سجلات البيانات الإدارية لتسريع تنزيل ورش تبادل البيانات وتواكب الإدارات على اعتماده وتحديد الإجراءات اللازمة لتطوير سجلاتها.
بالإضافة إلى إصدار مجموعة من الدعامات المنهجية: كدليل تبسيط المسارات والتحضير لرقمنتها ودليل إدارة التغيير، ودليل الاستماع للمرتفقين.
خامسا: إرساء بيئة ملائمة للإدارة الإلكترونية: عبر إغناء الجانب القانوني والتنظيمي، حيث عملت بتنسيق مع مختلف الشركاء على إنجاز مجموعة من النصوص القانونية،
مشاريع مراسيم تطبيقية للقانون رقم 19-55 المتعلق بتبسيط المساطر والإجراءات الإدارية، وهي قيد المصادقة.
مشروع قانون بشأن رقمنة الخدمات الإدارية وهو قيد مسطرة المصادقة.
كمشروع مرسوم بشأن التبادل الإلكتروني بين الإدارات للوثائق والمستندات الإدارية،
مشروع مرسوم حول المعطيات العمومية المفتوحة
سادسا: توفير الدعم المالي للإدارات من أجل تطوير مشاريع التحول الرقمي.
حيث قام صندوق تحديث الإدارة العمومية ودعم الانتقال الرقمي واستعمال الأمازيغية بتمويل عدة مشاريع متعلقة بالرقمنة بغلاف مالي يفوق 300 مليون درهم خلال السنة الجارية.
سابعا: تقوية اليات الحكامة من أجل تتبع ورش رقمنة الإدارات
بالإضافة إلى ما سبق، تعمل الوزارة بصفتها الكتابة الدائمة اللجنة الوطنية للتنمية الرقمية واللجنة الوطنية لتبسيط المساطر الإدارية على تتبع إنجاز الأوراش بتنسيق مع مختلف شركاءها لضمان نجاحها وتكاملها. كما تم أيضا العمل على إطلاق مبادرات تحفيزية متعددة، كإحداث شبكة سفراء الحكومة الإلكترونية والرقمنة ""رائد “وفق مقاربة تشاركية من أجل تشجيع التعاون بين مختلف القطاعات، ومشاركة أفضل الممارسات، وتشجيع تبادل الخبرات.
سؤال شفوي أني | "" تبسيط المساطر الإدارية لفائدة مغاربة العالم   "" | فريق الاصالة و المعاصرة
رقم 12266 | مجلس المستشارين 22/11/2024",,0.9955696272979286,,
" تدابير الحكومة لتحسين استقبال المرتفقين على مستوى مختلف وحدات الإدارة
العمومية؟","['Content: فيما يخص الشق المتعلق بتحسين الاستقبال بالمرافق العمومية، ووعيا من وزارة الانتقال الرقمي وإصلاح الإدارة بالمهام المنوطة بها في هذا المجال وانسجاما مع مضامين الخطاب الملكي سالف الذكر، وحرصها الشديد على تنزيل ما جاء به البرنامج الحكومي ، سيما المحور الثالث ""حكامة في خدمة المواطن وإدارة فعالة""، والذي تلتزم فيه الحكومة بتقريب وتحديث الجهاز الإداري مع تحسين ظروف اشتغال موظفي الإدارات العمومية وتعزيز مراقبة جودة الخدمات العمومية، فإن الوزارة تستمر في تفعيل مضامين البرنامج الوطني لتحسين الاستقبال بالمرافق العمومية، بمساهمة فعالة لبعض القطاعات الوزارية الأخرى وبشراكة مع برنامج الأمم المتحدة الإنمائي، بهدف خلق وحدات استقبال على صعيد جميع الإدارات العمومية مجهزة بالوسائل والمعدات التقنية الضرورية لحسن استقبال المرتفقين وتيسير ولوجهم إلى الخدمات العمومية بما فيهم الأشخاص ذوي الاحتياجات الخاصة.', 'Content: وفي هذا السياق، السيد الرئيس المحترم؛ حضرات السيدات والسادة المستشارين المحترمين،\n\n فإن وزارة الانتقال الرقمي وإصلاح الإدارة، وعيا منها بالمهام المنوطة بها في هذا المجال، وانسجاما مع مضامين الخطاب الملكي سالف الذكر، وحرصها الشديد على تنزيل ما جاء به البرنامج الحكومي 2021-2026، سيما المحور الثالث ""حكامة في خدمة المواطن وإدارة فعالة""، والذي تلتزم فيه الحكومة بتقريب وتحديث الجهاز الإداري مع تحسين ظروف اشتغال موظفي الإدارات العمومية وتعزيز مراقبة جودة الخدمات العمومية، فإن الوزارة تستمر في تفعيل مضامين البرنامج الوطني لتحسين الاستقبال بالمرافق العمومية، بمساهمة فعالة لبعض القطاعات الوزارية الأخرى وبشراكة مع برنامج الأمم المتحدة الإنمائي، بهدف خلق وحدات استقبال على صعيد جميع الإدارات العمومية مجهزة بالوسائل والمعدات التقنية الضرورية لحسن استقبال المرتفقين بكل فئاتهم وتيسير ولوجهم إلى الخدمات العمومية.', 'Content: وفي هذا السياق، السيد الرئيس المحترم؛ حضرات السيدات والسادة المستشارين المحترمين،\n\n فإن وزارة الانتقال الرقمي وإصلاح الإدارة، وعيا منها بالمهام المنوطة بها في هذا المجال، وانسجاما مع مضامين الخطاب الملكي سالف الذكر، وحرصها الشديد على تنزيل ما جاء به البرنامج الحكومي 2021-2026، سيما المحور الثالث ""حكامة في خدمة المواطن وإدارة فعالة""، والذي تلتزم فيه الحكومة بتقريب وتحديث الجهاز الإداري مع تحسين ظروف اشتغال موظفي الإدارات العمومية وتعزيز مراقبة جودة الخدمات العمومية، فإن الوزارة تستمر في تفعيل مضامين البرنامج الوطني لتحسين الاستقبال بالمرافق العمومية، بمساهمة فعالة لبعض القطاعات الوزارية الأخرى وبشراكة مع برنامج الأمم المتحدة الإنمائي، بهدف خلق وحدات استقبال على صعيد جميع الإدارات العمومية مجهزة بالوسائل والمعدات التقنية الضرورية لحسن استقبال المرتفقين وتيسير ولوجهم إلى الخدمات العمومية.']","تتضمن تدابير الحكومة لتحسين استقبال المرتفقين على مستوى مختلف وحدات الإدارة العمومية:

- تفعيل مضامين البرنامج الوطني لتحسين الاستقبال بالمرافق العمومية.
- خلق وحدات استقبال على صعيد جميع الإدارات العمومية مجهزة بالوسائل والمعدات التقنية الضرورية.
- تحسين ظروف اشتغال موظفي الإدارات العمومية.
- تعزيز مراقبة جودة الخدمات العمومية.
- الشراكة مع برنامج الأمم المتحدة الإنمائي لتحقيق هذه الأهداف.","الجواب
على السؤال الشفاهي رقم 12267
المتعلق ب "" تحسين استقبال المرتفقين بالإدارات العمومية""
*-*-*
مجلس النواب
(الفريق الاصالة والمعاصرة )
النائبة المحترم: خليد حاتمي
السيد رئيس مجلس النواب
- الاصالة والمعاصرة –
بسم الله الرحمن الرحيم
- الفريق الحركي -
السيد الرئيس المحترم،
السيدات والسادة النواب المحترمون،
بداية أتوجه بالشكر الجزيل إلى السيد رئيس فريق الحركة الشعبية على طرح السؤال الذي يندرج موضوعه في صميم الأهداف المسطرة ضمن البرنامج الحكومي، خاصة فيما يتعلق بمجال اصلاح الإدارة وتحديثها.
وبالرجوع إلى مضامين الخطاب الملكي ل( 14 أكتوبر 2016) والذي شكل منعطفا محوريا في مسلسل إصلاح الإدارة ومرجعية أساسية بمثابة خارطة طريق مستقبلية للتنزيل الفعلي للأوراش الإصلاحية الرامية إلى الاستجابة لتطلعات وانتظارات المواطنين وكذا الارتقاء بأداء ونجاعة الإدارة، حيث أكد جلالته حفظه الله على أن تدبير شؤون المواطنين، وخدمة مصالحهم، مسؤولية وطنية، وأمانة جسيمة، لا تقبل التهاون ولا التأخير، مبرزا مجموعة من الاختلالات، نذكر منها على الصعوبات المتمثلة في علاقة المواطن بالإدارة، والتي تبتدئ من الاستقبال، مرورا بالتواصل، إلى معالجة الملفات والوثائق، إضافة الى عدم الرد على شكايات وتساؤلات المواطنين.
وفي هذا السياق، السيد الرئيس المحترم؛ حضرات السيدات والسادة النواب المحترمين،
فإن وزارة الانتقال الرقمي وإصلاح الإدارة، وعيا منها بالمهام المنوطة بها في هذا المجال، وانسجاما مع مضامين الخطاب الملكي سالف الذكر، وحرصها الشديد على تنزيل ما جاء به البرنامج الحكومي 2021-2026، سيما المحور الثالث ""حكامة في خدمة المواطن وإدارة فعالة""، والذي تلتزم فيه الحكومة بتقريب وتحديث الجهاز الإداري مع تحسين ظروف اشتغال موظفي الإدارات العمومية وتعزيز مراقبة جودة الخدمات العمومية، فإن الوزارة تستمر في تفعيل مضامين البرنامج الوطني لتحسين الاستقبال بالمرافق العمومية، بمساهمة فعالة لبعض القطاعات الوزارية الأخرى وبشراكة مع برنامج الأمم المتحدة الإنمائي، بهدف خلق وحدات استقبال على صعيد جميع الإدارات العمومية مجهزة بالوسائل والمعدات التقنية الضرورية لحسن استقبال المرتفقين وتيسير ولوجهم إلى الخدمات العمومية بما فيهم الأشخاص ذوي الاحتياجات الخاصة.
وقد تجسدت هذه الرؤية المشتركة في إعداد منظومة الاستقبال ""إدارتي"" بشقيه (الحضوري والإلكتروني)، كرزنامة (Package) تتضمن ""ميثاق الاستقبال"" بالتزاماته العشرة تجاه المرتفق، وفي ""الإطار المرجعي"" لحسن الاستقبال، بالإضافة الى ""الدليل المنهجي"" الذي يحدد الاجراءات والتدابير العملية التي يتعين على كل ادارة مراعاتها لضمان تحقيق التزاماتها في هذا المضمار.
إن هذه المنظومة تشكل في الوقت الراهن مرجعا أساسيا لتجويد فضاءات الاستقبال، وسيتم تحسينه بصورة متواصلة اعتمادا على الخلاصات والدروس المستقاة من الممارسة الفعلية والتطبيق الميداني من خلال تنزيله على مستوى مجموعة من المواقع النموذجية، تمثل بعض القطاعات الوزارية التي تقدم مجموعة من الخدمات الإدارية لفائدة أعداد مهمة من المواطنين.
وفي هذا الصدد، وبشراكة مع بعض القطاعات العمومية، فإن وزارة الانتقال الرقمي وإصلاح الإدارة من خلال لبرنامج الوطني لتحسين الاستقبال، قامت بتهيئة مجموعة من فضاءات الاستقبال النموذجية ويتعلق الأمر ب:
الملحقة الإدارية السادسة الرجاء في الله، بحي يعقوب المنصور بالرباط بشراكة مع وزارة الداخلية -2017؛
القنصلية العامة للمملكة المغربية بالجزيرة الخضراء بشراكة مع وزارة الخارجية والتعاون الدولي -2018.
مركز تسجيل السيارات بالرباط بشراكة مع وزارة التجهيز والنقل) 2020.
فضاءات الاستقبال بالموقع النموذجي لرئاسة النيابة العامة بالرباط 2020.
تأهيل ثلاثة مواقع نموذجية بالمستشفى الإقليمي بالجديدة بشراكة مع وزارة الصحة، والاشغال في مراحلها الأخيرة، حيث سيتم الانتهاء منها عند متم شهر نونبر 2020.
تقديم الدعم التقني لتأهيل الموقع النموذجي للسجن المحلي عين السبع بالدار البيضاء كنموذج لتحسين زيارة عائلات نزلاء المؤسسات السجنية بشراكة مع المندوبية العامة لإدارة السجون وإعادة الإدماج، كما استفادت من الدعم التقني لتحسين الاستقبال الالكتروني بالمؤسسات السجنية بالمغرب.
اعداد برنامج لتكوين المكوين في مجال الاستقبال لفائدة مجموعة من موظفي وزارة الداخلية، النقل والصحة؛
تأطير دورات تكوينية بمختلف جهات المملكة حول برنامج الاستقبال، بمدن تطوان، مارتيل، طنجة، شفشاون، مراكش، خنيفرة، زاكورة، ورززات.
واستمرت هذه العمليات هذه السنة مع كل من وزارة العدل على مستوى محكمة الاستئناف بأكادير، والمديرية العامة للأمن الوطني على مستوى بعض المصالح بكل من تمارة والقنيطرة والدار البيضاء، وستتلوها مواقع نموذجية لبعض القطاعات العمومية الأخرى في أفق إنجاز 30 موقعا نموذجيا بمختلف جهات المملكة.
كما عملت الوزارة في مجال دعم استعمال الامازيغية على تمكين مجموعة من الوحدات الإدارية بمختلف القطاعات الحكومية من:
أعوان ناطقين باللغة الأمازيغية في مجال الاستقبال والإرشاد والتوجيه الحضوري باللغة الأمازيغية بلغ عددهم 464 عونا؛
أعوان ناطقين باللغة الأمازيغية في مجال الاستقبال الالكتروني بمراكز الاتصال؛
إدراج اللغة الامازيغية في اللوحات وعلامات التشوير المتواجدة بمقرات هذه الإدارات بأزيد من 3000 لائحة وعلامة تشوير؛
توفير 200 وحدة معلوماتية لضمان مواكبة اجتماعية ملائمة للمواطنين الناطقين باللغة الأمازيغية الذين يلجون إلى مرفق العدالة؛
اعتماد الترجمة الفورية للجلسات العامة بكل من مجلسي النواب والمستشارين باللغة الأمازيغية عبر تخصيص 12 مترجم متخصص في الترجمة الفورية إلى اللغة الأمازيغية .
إن تحسين العلاقة بين الإدارة والمرتفق تقتضي معالجة عدة مكونات تشكل الخدمة العمومية والتي لها انعكاس على رضا وانتظارات المرتفقين، حيث تعتبر ظروف وجودة استقبال المرتفقين بكل فئاتهم بالمرافق العمومية من بين هذه المكونات الأساسية. ومن هذا المنطلق، يهدف البرنامج الوطني لتحسين ظروف استقبال المرتفقين وتلقي طلباتهم واقتراحاتهم وشكاياتهم، وذلك من أجل تسهيل مسار المرتفق إلى أقصى درجة بالإدارة العمومية.
وفي هذا الإطار، فإن منظومة الاستقبال وضعت ضمن أولوياتها تيسير ولوج الأشخاص ذوي الاحتياجات الخاصة لمصالح المرافق العمومية سواء على مستوى الفضاء الخارجي أو على مستوى الفضاء الداخلي، من خلال ما يلي:
تخصيص الطابق السفلي كفضاء للاستقبال ليتيح لكل فئات المرتفقين الولوج بكل يسر وسهولة؛
توفير أماكن لوقوف السيارات والدراجات الخاصة بالمرتفقين، مع تحديد أماكن وولوجيات لفائدة الأشخاص ذوي الاحتياجات الخاصة؛
ولوج سهل إلى بهو المرفق العمومي مع تخصيص ممر منحدر يستجيب للمعايير المتعارف عليها لفائدة الأشخاص ذوي الاحتياجات الخاصة؛
تهيئة فضاء المرافق الصحية بالمواصفات والتجهيزات الضرورية مع مراعاة متطلبات الأشخاص ذوي الاحتياجات الخاصة في هذا الشأن؛
ولوج سهل إلى آلة ضبط الانتظار"" Système de gestion de file d’attente""؛
تهيئة شبابيك الخدمة بالشكل الذي من شأنه تسهيل ولوج هذه الفئة من المرتفقين إلى المكاتب الأمامية ""Front Office"".
وبهدف تعميم العمل بهذه المنظومة، فقد نصت المادة 25 من القانون رقم 19-54 الصادر بتنفيذه الظهير الشريف رقم 58-21-1 الصادر في 14 يوليوز 2021 بمثابة ميثاق المرافق العمومية، على ما يلي:
""يجب على المرافق العمومية أن تعمل بكيفية منتظمة على اتخاذ الإجراءات اللازمة لضمان جودة وحسن استقبال المرتفقين، لاسيما من خلال توفير كفاءات مؤهلة في مهام الاستقبال والتوجيه وتأهيل الفضاءات والبنيات المخصصة لذلك، بما يضمن الإصغاء إلى المرتفقين وإخبارهم وتوجيههم وإرشادهم وتيسير استفادتهم من الخدمات التي تقدمها. كما تتخذ التدابير اللازمة لتيسير ولوج الأشخاص والفئات من ذوي الاحتياجات الخاصة لمصالحها، ومساعدتهم في الحصول على خدماتها في ظروف مواتية، طبقا للتشريع الجاري به العمل.""
وتنزيلا لما جاء بالميثاق، فإن وزارة الانتقال الرقمي وإصلاح الإدارة تعمل على إعداد مشروع مرسوم بشأن تحسين استقبال المرتفقين للحصول على الخدمات العمومية، والذي يروم تحديد الضوابط التي يتعين على الإدارات التقيد بها لضمان جودة وحسن استقبال المرتفقين، لا سيما من خلال توفير كفاءات مؤهلة في مهام الاستقبال والتوجيه، وتأهيل الفضاءات والبنيات المخصصة لذلك، بما يضمن الإصغاء إلى المرتفقين وإخبارهم وتوجيههم وإرشادهم وتيسير استفادتهم من الخدمات. كما يتعلق الأمر بالتدابير اللازمة لتيسير ولوج الأشخاص والفئات من ذوي الاحتياجات الخاصة لهذه الفضاءات، ومساعدتهم في الحصول على الخدمات في ظروف مواتية.
السيد الرئيس المحترم؛ حضرات السيدات والسادة النواب المحترمين،
ان منظومة الاستقبال ""إدارتي"" تنبني فلسفتها على مجموعة من المرتكزات، نوجزها في النقاط التالية:
توحيد الاستقبال والإرشاد من خلال تخصيص مقرات للاستقبال تتوفر على الوسائل المادية والبشرية المناسبة؛
توفير معلومات صحيحة وكاملة ودقيقة عن الخدمات التي تسديها المصالح الإدارية؛
توفير وسائل تواصلية من ملصقات ووسائل تشويرية لتسهيل الاهتداء إلى المرافق والمكاتب التي تهم الوافدين عليها داخل وخارج كل وحدة إدارية؛
الرد على الطلبات ومعالجة القضايا والملفات التي تهم المتعاملين مع الإدارة؛
إيلاء أهمية للشكايات كرافد هام من روافد إعادة الثقة بين الإدارة والمواطن وتحسين أساليب تنظيمها وتسييرها؛
توفير الوسائل التي تمكن المواطن من الاستفادة من خدمات الإدارة بشفافية ووضوح وفي احترام تام للقانون؛
التكوين لفائدة العاملين بمختلف فضاءات الاستقبال.
هذا من جهة، ومن جهة أخرى فالوزارة تعمل على دعم الإدارات العمومية من خلال التمويل الجزئي لمبادراتها المتعلقة بتحسين الاستقبال من خلال صندوق تحديث الإدارة، هذا الصندوق يتيح لمختلف الإدارات العمومية إمكانية تقديم مشاريع تروم تحسين فضاءات الاستقبال بمقراتها بنسبة مهمة تفوق 50 % من قيمة المشروع، إضافة الى المواكبة التقنية في هذا المجال.
إن البرنامج الوطني لتحسين الاستقبال بالمرافق العمومية يحمل في مخططاته إحداث بارومتر لقياس جودة الخدمات العمومية بفضاءات الاستقبال العمومية وتمكين المتميزة منها بعلامة الجودة للاستقبال ""إدارتي""، هذا النوع من الممارسات المهنية سوف تنعكس إيجابا على مستوى تقديم الخدمة العمومية ببلادنا.
وفي الختام، لا يسعني سوى أن أؤكد لكم مرة أخرى العناية الخاصة التي توليها الحكومة ومن خلالها وزارة الانتقال الرقمي وإصلاح الإدارة لهذا الورش الهام، وهو ما يتطلب من كل القطاعات العمومية بذل المزيد من المجهودات الجبارة للارتقاء بفضاءات الاستقبال الى المستوى الذي ينشده المواطن بتطلعات المرتفقين.
والسلام عليكم ورحمة الله تعالى وبركاته.",0.8571428571428571,,,
 تنزيل استراتيجية تبسيط المساطر الإدارية لتشجيع الاستثمار؟,"['Content: سؤال شفهي\n\n"" تبسيط المساطر الإدارية لتشجيع الاستثمار ""\xa0\n\nفريق الاصالة و المعاصرة \n\n\xa0\n\nرقم 12270\xa0\n\nمجلس النواب\xa006/12/2024\xa0\n\n\xa0\n\nالسيد الرئيس المحترم،\xa0\n\nالسيدات والسادة النواب المحترمون،\xa0\n\nأود بدايةً أن أتقدم بالشكر الجزيل للسيد النائب المحترم عن فريق الاصالة و المعاصرة على اهتمامه وطرحه لهذا السؤال، الذي يندرج ضمن الأولويات الاستراتيجية للبرنامج الحكومي (2021-2026)، والذي جاء تنفيذاً للتوجيهات الملكية السامية لصاحب الجلالة نصره الله، التي أكدت على ضرورة رقمنة الإجراءات والمساطر العمومية لتوفير خدمات سهلة، شفافة، وذات جودة عالية تُلبّي تطلعات المواطنين والمرتفقين.\n\nوفي هذا السياق، تضع الوزارة هذا الورش الطموح ضمن رؤية استراتيجية ""المغرب الرقمي 2030""، التي حظيت بالدعم الملكي السامي، مع تخصيص استثمارات مالية وبشرية ضخمة لضمان نجاحه. وتعمل الوزارة على تحقيق هذا الهدف من خلال عدة محاور رئيسية:\n\n1. مواكبة الرقمنة وتبسيط المسارات الإدارية للمرتفقين :', 'Content: انجازات ورش رقمنة الإدارات\xa0\n\n1. تنزيلًا للرؤية الملكية السامية، واعتمادًا على توجهات النموذج التنموي الجديد، تضع استراتيجية المغرب الرقمي 2030 ورش تبسيط المساطر والإجراءات الإدارية ضمن أولوياتها، حيث تنص على اعتماد مقاربة شاملة واستشرافية لتبسيط ورقمنة المساطر الإدارية\xa0 من خلال تبسيط المسارات الأكثر طلبًا وذات الوقع الأكبر على المرتفق، وذلك بالعمل على تقليص عدد المراحل اللازمة لمعالجة طلبات المرتفقين، وتقليص عدد الوثائق المطلوبة، وتقليص أجل معالجة القرارات الإدارية المتعلقة بهذه المسارات، وكذا تخفيض المصاريف المترتبة عنها.\xa0 وفي هذا الإطار، حددت وزارة الانتقال الرقمي وإصلاح الإدارة مجموعة من المسارات ذات الأولوية في مجالات متعددة منها: الصحة، والتربية الوطنية، والاستثمار، والتوظيف، كما تم توقيع عدة اتفاقيات مع الإدارات المعنية من أجل تبسيط ورقمنة هذه المسارات ومنها تلك التي تم الشروع في العمل عليها.', 'Content: الموضوع الذي تجعله الوزارة كذلك على رأس أولوياتها ضمن رؤية استراتيجية المغرب الرقمي 2030 التي حظيت بالمباركة المولوية السامية. فكما تعلمون، تأتي هذه الاستراتيجية الوطنية استجابة للرؤية السامية لصاحب الجلالة نصره الله، الذي أكد على أهمية التحول الرقمي و دوره في تحسين جودة الخدمات المقدمة للمواطنين، وتعزيز الشفافية   والفعالية في الإدارة العمومية، و مواكبة التطورات التكنولوجية العالمية لتحقيق التنمية المستدامة والشاملة للمملكة .   \n\nوفي هذا السياق, عملت وزارة الانتقال الرقمي وإصلاح الإدارة، في إطار تنزيل التوجهات الوطنية الكبرى الرامية إلى تسريع التحول الرقمي للإدارة المغربية، على إرساء منظومة وطنية متكاملة للربط البيني بين الإدارات العمومية، باعتبارها إحدى الركائز الأساسية لبناء إدارة حديثة، فعّالة، شفافة ومندمجة.\n\nويهدف هذا الورش إلى تمكين مختلف الإدارات من تبادل الوثائق والمستندات الإدارية بشكل آمن وسلس، والانتقال من منطق “الإدارة تطلب من المواطن الوثيقة” إلى منطق “الإدارة تتبادل الوثائق فيما بينها”، بما يخفف العبء عن المرتفقين، ويقوي ثقة المواطن في المرفق العمومي.']","تنزيل استراتيجية تبسيط المساطر الإدارية لتشجيع الاستثمار يتم من خلال عدة محاور رئيسية، منها:

1. مواكبة الرقمنة وتبسيط المسارات الإدارية للمرتفقين.
2. تبسيط المساطر والإجراءات الإدارية ضمن رؤية استراتيجية ""المغرب الرقمي 2030"".
3. إرساء منظومة وطنية متكاملة للربط البيني بين الإدارات العمومية.
4. تمكين الإدارات من تبادل الوثائق والمستندات الإدارية بشكل آمن وسلس.","السيد الرئيس المحترم،
السيدات والسادة النواب المحترمون،
أود بدايةً أن أتقدم بالشكر الجزيل للسيد النائب المحترم عن فريق الاصالة و المعاصرة على اهتمامه وطرحه لهذا السؤال، الذي يندرج ضمن الأولويات الاستراتيجية للبرنامج الحكومي (2021-2026)، والذي جاء تنفيذاً للتوجيهات الملكية السامية لصاحب الجلالة نصره الله، التي أكدت على ضرورة رقمنة الإجراءات والمساطر العمومية لتوفير خدمات سهلة، شفافة، وذات جودة عالية تُلبّي تطلعات المواطنين والمرتفقين.
وفي هذا السياق، تضع الوزارة هذا الورش الطموح ضمن رؤية استراتيجية ""المغرب الرقمي 2030""، التي حظيت بالدعم الملكي السامي، مع تخصيص استثمارات مالية وبشرية ضخمة لضمان نجاحه. وتعمل الوزارة على تحقيق هذا الهدف من خلال عدة محاور رئيسية:
1. مواكبة الرقمنة وتبسيط المسارات الإدارية للمرتفقين :
تم دعم قطاعات وزارية عديدة لتبسيط ورقمنة خدماتها بهدف تشجيع و تحسين مسارات المستثمرين في إطار أولويات تحسين مناخ الأعمال وتعزيز تنافسية الاقتصاد الوطني في إطار الإجراءات الاستعجالية ذات الأولوية الرامية إلى تحسين مناخ الأعمال ودعم تنافسية الاقتصاد الوطني؛ وعلاقة بالقرارات الإدارية اللازمة لإنجاز مشاريع الاستثمار بتنسيق مع وزارة الاستثمار والتقائية وتقييم السياسات العمومية ومختلف الشركاء:
رقمنة مسار الحصول على رخص فتح واستغلال دور الحضانة بالتعاون مع وزارة الشباب والثقافة والتواصل.
تبسيط ورقمنة دعم الدولة للشركات العاملة في مجال ترحيل الخدمات (Offshoring).
كما أعدت الوزارة دليلاً منهجياً لتبسيط مسارات المرتفقين،
2. الاستثمار في البنية التحتية الرقمية :
إنشاء ""المختبر الرقمي"" التابع لوكالة التنمية الرقمية، الذي أنجز 15 مشروعاً لدعم الإدارات في رقمنة خدماتها.
تطوير منصات مشتركة مثل البوابة الوطنية idarati.ma، التي تضم أكثر من 600 خدمة رقمية، ومشروع منصة الحساب الرقمي لتبسيط التبادل البيني للبيانات بين الإدارات.
3. تعزيز الحوكمة الرقمية:
-تطوير الإطار المرجعي لقياس نضج البيانات الإدارية وتوفير الدعم المالي اللازم، حيث تم رصد أكثر من 300 مليون درهم خلال السنة الجارية لدعم مشاريع التحول الرقمي.
-إطلاق مبادرات تحفيزية مثل شبكة ""رائد"" لسفراء الحكومة الإلكترونية والرقمنة، لتعزيز التعاون وتبادل الخبرات بين القطاعات.
-بفضل هذه الاستثمارات والجهود المتواصلة، نؤكد التزامنا بتسريع ورش الرقمنة وتقديم خدمات مبتكرة تُسهم في تحسين جودة الحياة للمواطنين وتعزيز تنافسية الاقتصاد الوطني.
بالإضافة إلى ما سبق، تعمل الوزارة بصفتها الكتابة الدائمة اللجنة الوطنية للتنمية الرقمية واللجنة الوطنية لتبسيط المساطر الإدارية على تتبع إنجاز الأوراش بتنسيق مع مختلف شركاءها لضمان نجاحها وتكاملها. كما تم أيضا العمل على إطلاق مبادرات تحفيزية متعددة، كإحداث شبكة سفراء الحكومة الإلكترونية والرقمنة ""رائد “ وفق مقاربة تشاركية من أجل تشجيع التعاون بين مختلف القطاعات، ومشاركة أفضل الممارسات، وتشجيع تبادل الخبرات.
سؤال شفهي | "" تبسيط المساطر الإدارية لتشجيع الاستثمار "" | فريق الاصالة و المعاصرة
رقم 12270 | مجلس النواب 06/12/2024",1.0,,0.9999999999666667,1.0
"نسائلكن عن الإجراءات والتدابير التي تتخذها وزارتكم لتعزيز رقمنة الإدارة وتحسين خدماتها
الإلكترونية؟","['Content: نسائلكن عن الإجراءات والتدابير التي تتخذها وزارتكم لتعزيز رقمنة الإدارة وتحسين خدماتها الإلكترونية؟\n\nتعمل الوزارة تعمل على تنسيق الجهود الرامية لتنزيل ورش رقمنة الإدارة وفق هذه الرؤية وذلك عبر عدة محاور منها:\xa0\xa0\n\nأولا: مواكبة الإدارات في تبسيط ورقمنة مسارات المرتفق: \n\nمن خلال دعم ومواكبة مجموعة من القطاعات الوزارية في تبسيط ورقمنة خدماتها وتحولها الرقمي، و من أبرزها:\xa0\xa0\n\n  تبسيط مسار الترشيح الحر للباكالوريا بشكل جذري ورقمتنه عبر إطلاق البوابة الوطنية للتسجيل الحر في الباكالوريا، بوابة إلكترونية موحدة توفر جميع المعلومات والخدمات المرتبطة بالتسجيل.\n\nمكنت عملية التبسيط هذه إلى خفض :\n\nـ الوقت المستغرق للترشيح من يومين إلى أقل من 20 دقيقة\n\nـ عدد الوثائق المطلوبة من 18 وثيقة إلى 0 وثيقة\n\nـ عدد التنقلات من6 إلى 0، حيث أن الخدمة أصبحت 100% عبر الأنتيرنيت، رمزا للثقة بين المواطن و الإدارة', 'Content: عناصر الجواب\n\n على السؤال رقم 17512\n\nالمتعلق ب "" حصيلة ورش الرقمنة بالإدارات العمومية""\n\n*-*-*\n\nيشكل ورش الرقمنة أحد الأوراش الاستراتيجية الكبرى التي اعتمدتها بلادنا بتوجيه ملكي من صاحب الجلالة الملك محمد السادس نصره الله، بغية تحديث الإدارة العمومية وتبسيط المساطر وتحسين جودة الخدمات المقدمة للمرتفقين وللمقاولات، فضلا عن تعزيز الشفافية والنجاعة الإدارية.\n\n إلا أن الملاحظ أن عدد من المرتفقين لا يزالون يواجهون صعوبات مرتبطة بتفاوت مستوى رقمنة الخدمات بين الإدارات وضعف الربط البيني بين المنصات الرقمية واستمرار الحاجة الى الوثائق الورقية والحضور المادي في عدد من الإجراءات الإدارية رغم إطلاق عدة برامج ومبادرات رقمية.\n\nوعليه، نسائلكن السيدة الوزيرة المحترمة عن حصيلة ورش الرقمنة بالإدارات العمومية إلى حدود اليوم؟ وماهي المجهودات التي تقومون بها من أجل تقليص الفوارق في الولوج إلى الخدمات العمومية؟', 'Content: السيد الوزير المنتدب لدى رئيس الحكومة\n\n\tالمكلف بالعلاقات مع البرلمان والمجتمع المدني\n\n\t\n\n\t\n\n\t\n\n\tالموضوع: سؤال كتابي حول الإجراءات التي تتخذها الوزارة المنتدبة لدى رئيس الحكومة المكلفة بالانتقال الرقمي وإصلاح الإدارة، لتسريع الانتقال الرقمي وتبسيط الإجراءات الإدارية.\n\n\tالمرجــــع: سؤال كتابي لفريق جبهة القوى الديمقراطية بمجلس النواب رقم 19130بتاريخ 26 دجنبر 2024.\n\n\t\n\nسلام تام بوجود مولانا الإمام،\n\n\t\n\n\t              وبعد، يشرفني أن أحيل عليكم الجواب على السؤال الكتابي المشار إليه في الموضوع أعلاه، والذي تقدم به السادة النواب عن فريق جبهة القوى الديمقراطية بمجلس النواب، وذلك قصد إجراء المتعين.\n\n\t\n\n\tوتفضلوا بقبول فائق التقدير.\n\n\t\n\n\t\n\n\t\n\n\t\n\n\t\t\n\n\t\t\n\n\t\tالسادة النواب المحترمون \n\n\t\t- جبهة القوى الديمقراطية -\n\n\t\t-مجلس النواب -\n\n\t\t\n\nالموضوع: سؤالكم الكتابي حول الإجراءات التي تتخذها الوزارة المنتدبة لدى رئيس الحكومة المكلفة بالانتقال الرقمي وإصلاح الإدارة،لتسريع الانتقال الرقمي وتبسيط الإجراءات الإدارية.\n\n\tالمرجـــع: سؤالكم الكتابي رقم 19130بتاريخ 26دجنبر 2024.\n\n\t\n\n\t\n\nسلام تام بوجود مولانا الإمام،']",تعمل الوزارة على تنسيق الجهود الرامية لتنزيل ورش رقمنة الإدارة، ومنها مواكبة الإدارات في تبسيط ورقمنة مسارات المرتفق، مثل تبسيط مسار الترشيح الحر للباكالوريا بشكل جذري ورقمتنه عبر إطلاق البوابة الوطنية للتسجيل الحر في الباكالوريا.,"السيد الرئيس المحترم،
السيدات والسادة النواب المحترمون،
في البداية أوجه الشكر للسيد النائب المحترم، عن فريق الأصالة والمعاصرة، على طرح هذا السؤال واهتمامه بهذا الموضوع الذي يندرج ضمن أهم الإجراءات التي جاء بها البرنامج الحكومي (2026 – 2021) تماشيا مع توجيهات صاحب الجلالة نصره الله، الذي دعا لرقمنة الخدمات العمومية، من أجل توفير الخدمات العمومية بشكل بسيط وسهل وشفاف بما يستجيب لحاجيات وتطلعات المرتفقين.
الموضوع الذي تجعله الوزارة على رأس أولوياتها ضمن رؤية استراتيجية المغرب الرقمي 2030 التي حظيت بالمباركة المولوية السامية. وعليه فإن الوزارة تعمل على تنسيق الجهود الرامية لتنزيل ورش رقمنة الإدارة وفق هذه الرؤية وذلك عبر عدة محاور منها:
أولا: مواكبة الإدارات في تبسيط ورقمنة مسارات المرتفق: من خلال دعم ومواكبة مجموعة من القطاعات الوزارية في تبسيط ورقمنة خدماتها وتحولها الرقمي، وعلى سبيل المثال:
تبسيط ورقمنة مسار الحصول على رخصة فتح واستغلال دور الحضانة، والذي يتضمن عشر 10 مساطر إدارية بتنسيق وطيد مع وزارة الشباب والثقافة والتواصل،
تبسيط ورقمنة مسار الحصول على دعم الدولة المتعلق بالضريبة على الشركات​ والضريبة على الدخل بالنسبة للشركات العاملة في مجال ترحيل الخدمات (Offshoring)
تبسيط ورقمنة مجموعة من المسارات ذات الأولوية للمستثمرين في إطار الإجراءات الاستعجالية ذات الأولوية الرامية إلى تحسين مناخ الأعمال ودعم تنافسية الاقتصاد الوطني؛ وعلاقة بالقرارات الإدارية اللازمة لإنجاز مشاريع الاستثمار بتنسيق مع وزارة الاستثمار والتقائية وتقييم السياسات العمومية ومختلف الشركاء.
مواكبة وزارة التربية الوطنية والتعليم الاولي والرياضة في تبسيط ورقمنة مساري ""الترشيح لامتحان الباكالوريا الحرة"" و""تسجيل الأطفال بالمدرسة""
مواكبة وزارة الصحة في تبسيط ورقمنة مجموعة من المسارات ذات الأولوية والمرتبطة بالورش الملكي المتعلق بتعميم الحماية الاجتماعية وإصلاح المنظومة الصحية.
وفي إطار مواصلة الجهود في تبسيط ورقمنة المساطر الإدارية، ومن أجل تعميم العمل على تبسيط مسارات المرتفقين، أعدت وزارة الانتقال الرقمي وإصلاح الإدارة دليلا منهجيا للتبسيط والإعداد لرقمنة مسارات المرتفقين لفائدة الإدارات العمومية، وقد تم وضع هذه المنهجية بالاعتماد على مقاربة تجريبية أثبتت فعاليتها من خلال نتائجها الملموسة لدى المرتفقين والتي تتجلى في تخفيض نسبة 45% من عدد الوثائق المطلوبة على مستوى الأوراش الأولى التي تم تنفيذها بها، وقد تم نشرها بالموقع الإلكتروني للوزارة بالقسم المتعلق ب"" الدلائل والإصدارات""، وسيتم التواصل بشأنه في مرحلة لاحقة.
ثانيا: إحداث المختبر الرقمي لوكالة التنمية الرقمية الذي يعتمد في اشتغاله على طرق مرنة من أجل مواكبة الإدارات في تصميم ورقمنة خدماتها الموجهة للعموم حيث عمل على إنجار ما يقارب 15 مشروعا في هذا الصدد.
ثالثا: تصميم وتنفيذ البوابات المشتركة:
كالبوابة الوطنية للمساطر والإجراءات الإدارية idarati.ma، والمرجع الوطني للخدمات العمومية الرقمية، الذي يهدف لتجميع وتصنيف مختلف الخدمات العمومية المتاحة عبر الانترنيت وتسهيل وصول المرتفقين إليها. والذي يضم أكثر من   600خدمة رقمية. والمشروع في مراحله الأخيرة وسيتم إطلاقه في أقرب الآجال.
بالإضافة إلى ذلك، تعمل الوزارة على تطوير وإغناء المنصة الوطنية للتبادل البيني والإعداد لإطلاق مشروع تصميم منصة الحساب الرقمي وذلك من أجل تسهيل تبادل البيانات بين الإدارات وتمكين المرتفقين من الولوج والاضطلاع عليها بغاية تبسيط المساطر والإجراءات الإدارية ورفع فعالية الإدارة.
رابعا: مواكبة النضج الرقمي للإدارات العموم،
حيث عملت الوزارة على إعداد الإطار المرجعي لقياس نضج سجلات البيانات الإدارية لتسريع تنزيل ورش تبادل البيانات وتواكب الإدارات على اعتماده وتحديد الإجراءات اللازمة لتطوير سجلاتها.
بالإضافة إلى إصدار مجموعة من الدعامات المنهجية: كدليل تبسيط المسارات والتحضير لرقمنتها ودليل إدارة التغيير، ودليل الاستماع للمرتفقين.
خامسا: إرساء بيئة ملائمة للإدارة الإلكترونية: عبر إغناء الجانب القانوني والتنظيمي، حيث عملت بتنسيق مع مختلف الشركاء على إنجاز مجموعة من النصوص القانونية،
مشاريع مراسيم تطبيقية للقانون رقم 19-55 المتعلق بتبسيط المساطر والإجراءات الإدارية، وهي قيد المصادقة.
مشروع قانون بشأن رقمنة الخدمات الإدارية وهو قيد مسطرة المصادقة.
كمشروع مرسوم بشأن التبادل الإلكتروني بين الإدارات للوثائق والمستندات الإدارية،
مشروع مرسوم حول المعطيات العمومية المفتوحة
سادسا: توفير الدعم المالي للإدارات من أجل تطوير مشاريع التحول الرقمي.
حيث قام صندوق تحديث الإدارة العمومية ودعم الانتقال الرقمي واستعمال الأمازيغية بتمويل عدة مشاريع متعلقة بالرقمنة بغلاف مالي يفوق 300 مليون درهم خلال السنة الجارية.
سابعا: تقوية اليات الحكامة من أجل تتبع ورش رقمنة الإدارات
بالإضافة إلى ما سبق، تعمل الوزارة بصفتها الكتابة الدائمة اللجنة الوطنية للتنمية الرقمية واللجنة الوطنية لتبسيط المساطر الإدارية على تتبع إنجاز الأوراش بتنسيق مع مختلف شركاءها لضمان نجاحها وتكاملها. كما تم أيضا العمل على إطلاق مبادرات تحفيزية متعددة، كإحداث شبكة سفراء الحكومة الإلكترونية والرقمنة ""رائد “ وفق مقاربة تشاركية من أجل تشجيع التعاون بين مختلف القطاعات، ومشاركة أفضل الممارسات، وتشجيع تبادل الخبرات.
سؤال شفوي أني | "" رقمنة الإدارة المغربية"" | فريق الأصالة والمعاصرة
رقم 12537 | مجلس النواب  19/12/2024",1.0,0.9090804415312023,,0.9230769230769231
"إشراك الإدارات العمومية للمرتفقين والإنصات لشكاويهم
","['Content: الجواب\n\n على السؤال شفوي رقم 12941\n\n المتعلق بـــــــــــ "" إشراك الإدارات العمومية للمرتفقين والانصات لشكاويهم ""\n\n*-*-*\n\nمجلس النواب\n\n(الفريق الاستقلالي للوحدة والتعادلية)\n\nالسيد رئيس مجلس النواب\n\n- الفريق الاستقلالي للوحدة والتعادلية –\n\n بسم الله الرحمن الرحيم\n\nالسيد الرئيس المحترم، \n\nالسيدات والسادة النواب المحترمون،\n\nبداية أتوجه بالشكر الجزيل على طرح هذا السؤال الذي يندرج موضوعه في صميم الأهداف المسطرة ضمن البرنامج الحكومي، خاصة فيما يتعلق بمجال إصلاح الإدارة من أجل تحسين علاقة الإدارة بالمرتفق.', 'Content: كمشروع مرسوم بشأن التبادل الإلكتروني بين الإدارات للوثائق والمستندات الإدارية،\u202f\u202f\xa0\n\nمشروع مرسوم حول المعطيات العمومية المفتوحة\u202f\n\nوفي السياق نفسه، أطلقت الوزارة مشروع إنجاز استبيانات دورية لقياس مستوى رضا المرتفقين عن الخدمات الرقمية المقدمة، باعتبارها أداة أساسية لتحسين جودة الخدمات وتوجيه قرارات التطوير.\nويهدف هذا المشروع إلى ترسيخ المقاربة التشاركية، من خلال إشراك المرتفقين بشكل مباشر في تقييم الخدمات، ورصد انتظاراتهم واقتراحاتهم، واستثمار نتائج هذه الاستبيانات في تجويد المسارات الرقمية وتعزيز المشاركة المواطِنة في تطوير الإدارة الرقمية.\n\nوانطلاقًا مما سبق عرضه بخصوص آليات تبسيط ورقمنة المساطر والخدمات الإدارية، وما تتيحه من تقليص للآجال، وتخفيف للأعباء الإدارية، وتحسين لولوج المرتفقين إلى الخدمات العمومية، فإن هذا الورش لا يقتصر فقط على تحديث الإدارة، بل يشكّل رافعة أساسية لدعم البرامج الحكومية الموجهة للشباب.', 'Content: إعداد دليل منهجي حول إدارة التغيير بمجالات تبسيط ورقمنة الخدمات العمومية المقدمة للمرتفقين بمختلف الإدارات العمومية؛\xa0\n\nتكوين مكونين حول إدارة التغيير بكل من وزارة الانتقال الرقمي وإصلاح الإدارة ووكالة التنمية الرقمية بهدف تجويد المنهجية المصممة وذلك عبر اعتمادها في تجربتين نموذجيتين؛\n\nتكوين المكونين حول إدارة التغيير بالإدارات العمومية فيما يتعلق بتنزيل المشاريع المتعلقة بتبسيط ورقمنة مسارات المرتفقين، بقطاعي الصحة والشباب كتجربتين نموذجيتين.\n\nنشر\xa0دليل إدارة التغيير وتعميمه على باقي الإدارات.']",إشراك الإدارات العمومية للمرتفقين والإنصات لشكاويهم يتم من خلال مشروع إنجاز استبيانات دورية لقياس مستوى رضا المرتفقين عن الخدمات الرقمية المقدمة، وتوجيه قرارات التطوير بناءً على نتائج هذه الاستبيانات.,"الجواب
على السؤال شفوي رقم 12941
المتعلق بـــــــــــ "" إشراك الإدارات العمومية للمرتفقين والانصات لشكاويهم ""
*-*-*
مجلس النواب
(الفريق الاستقلالي للوحدة والتعادلية)
السيد رئيس مجلس النواب
- الفريق الاستقلالي للوحدة والتعادلية –
بسم الله الرحمن الرحيم
السيد الرئيس المحترم،
السيدات والسادة النواب المحترمون،
بداية أتوجه بالشكر الجزيل على طرح هذا السؤال الذي يندرج موضوعه في صميم الأهداف المسطرة ضمن البرنامج الحكومي، خاصة فيما يتعلق بمجال إصلاح الإدارة من أجل تحسين علاقة الإدارة بالمرتفق.
وبالرجوع إلى مضامين الخطاب الملكي ل( 14 أكتوبر 2016) والذي شكل منعطفا محوريا في مسلسل إصلاح الإدارة ومرجعية أساسية بمثابة خارطة طريق مستقبلية للتنزيل الفعلي للأوراش الإصلاحية الرامية إلى الاستجابة لتطلعات وانتظارات المواطنين وكذا الارتقاء بأداء ونجاعة الإدارة، حيث أكد جلالته حفظه الله على أن تدبير شؤون المواطنين، وخدمة مصالحهم، مسؤولية وطنية، وأمانة جسيمة، لا تقبل التهاون ولا التأخير، مبرزا مجموعة من الاختلالات، نذكر منها على سبيل المثال الصعوبات المتمثلة في علاقة المواطن بالإدارة، والتي تبتدئ من الاستقبال، مرورا بالتواصل، إلى معالجة الملفات والوثائق، إضافة الى عدم الرد على شكايات وتساؤلات المواطنين.
وفي هذا السياق، السيد الرئيس المحترم؛ حضرات السيدات والسادة النواب المحترمين،
فإن وزارة الانتقال الرقمي وإصلاح الإدارة، وعيا منها بالمهام المنوطة بها في هذا المجال، وانسجاما مع مضامين الخطاب الملكي سالف الذكر، وحرصها الشديد على تنزيل ما جاء به البرنامج الحكومي 2021-2026، قد اعتمدت مقاربة شمولية وفق منهجية توافقية مع القطاعات الوزارية والهيئات المعنية، حسب الاختصاصات والصلاحيات المخولة لها، تستند على مجموعة من المداخل الإصلاحية، خاصة في مجال تحسين علاقة الإدارة بالمواطن من خلال الاهتمام بالاستقبال وتبسيط المساطر الإدارية ورقمتنها وتتبع ومعالجة الشكايات.
وعلى هذا الأساس، وتنزيلا لما جاء بالبرنامج الحكومي 2021-2026، سيما بالمحور الثالث ""حكامة في خدمة المواطن وإدارة فعالة""، والذي تلتزم فيه الحكومة بتقريب وتحديث الجهاز الإداري مع تحسين ظروف اشتغال موظفي الإدارات العمومية وتعزيز مراقبة جودة الخدمات العمومية، فإن الوزارة لا تذخر أي جهد للارتقاء بعلاقة الإدارة بالمرتفق، وخاصة في الشق المتعلق بشكاياتهم وملاحظاتهم واقتراحاتهم، حيث يعتبر نظام معالجة الشكايات أحد الآليات التدبيرية الأساسية بالنسبة لتعزيز علاقة الإدارة بالمرتفقين، نظرا لما له من دور فعال في تقليص الهوة الحاصلة على مستوى الجودة بين الخدمات التي ينتظرها المواطنون وتلك التي تقدمها لهم الإدارة فعليا، ويمكن هذا النظام من اطلاع الإدارات العمومية على مستوى رضا مرتفقيها واستثمار ذلك في تجويد أدائها وتحسين الخدمات التي تقدمها.
وفي هذا السياق، فقد تم إصدار المرسوم رقم 2.17.265 بتاريخ 29 يونيو2017 المتعلق بتحديد كيفيات تلقي ملاحظات المرتفقين واقتراحاتهم وشكاياتهم وتتبعها ومعالجتها، والذي يهم إدارات الدولة والمؤسسات العمومية وكل شخص اعتباري يمارس صلاحيات السلطة العمومية ويحدد مسطرة تلقي الشكاية وتتبعها ومعالجتها وآجال الرد عليها.
وتنزيلا لمقتضيات المرسوم المذكور، فقد تم إطلاق البوابة الوطنية الموحدة للشكايات chikaya.ma بتاريخ 9 يناير 2018 برئاسة السيد رئيس الحكومة، حيث تم وضع منظومة متكاملة لتسهيل عملية تقديم الشكايات وإبداء الملاحظات والاقتراحات حول الخدمات العمومية المقدمة للمرتفقين، وذلك من خلال إمكانية التواصل مع المسؤولين بالإدارات العمومية من أي مكان وعلى مدار الساعة، وإتاحة خاصية تتبع الشكايات والاطلاع على الردود المقدمة من الإدارات المعنية.هذا فضلا عن إمكانية إعادة فتح الشكاية في حالة عدم الرضا عن الإجابة المتوصل بها وكذلك توفير نظام تقييم للخدمات، يسمح للمواطنين بإبداء آرائهم حول جودة المعالجة.
ومن بين أهداف إرساء هذه المنظومة أيضا التوفر على بوابة موحدة ومتكاملة، أي أن جميع الشكايات المتوصل بها من طرف الإدارات العمومية سواء بشكل ورقي أو شفهيا لدى مكاتب ضبط الإدارات أو غيرها، يتم تدوينها بالمكتب الخلفي للبوابة الوطنية للشكايات حتى تتمكن الإدارات من التوفر على إحصائيات ذات معنى من شأنها المساهمة في صنع القرارات الهادفة إلى تحسين الخدمات العمومية.
أما فيما يخص الشكايات المتوصل بها عبر البوابات الخاصة بالإدارات العمومية، فإنه جدير بالتوضيح أن هاته الشكايات تحال بشكل أوتوماتيكي على البوابة الخلفية للبوابة الوطنية للشكايات، وللتذكير فإن الهدف من تعدد قنوات تقديم الشكايات هو تيسير ولوج المرتفقين لتقديم شكاياتهم.
وللإشارة، فإن ما يسري على الشكايات الإلكترونية يسري على باقي الشكايات الأخرى، حيث إن الإدارات ملزمة بالإجابة عليها داخل الأجل القانوني المتمثل في 60 يوما.
وبهدف مواكبة الإدارات العمومية في إرساء واستعمال هذه المنظومة، قامت وزارة الانتقال الرقمي وإصلاح الإدارة بإعداد دليل عملي لتلقي وتتبع ومعالجة شكايات المرتفقين وملاحظاتهم واقتراحاتهم لفائدة الإدارات العمومية، يخص العمل بمنظومة الشكايات ويشمل مختلف الجوانب التي تهم هذا الورش الهام، وتم توزيعه على مختلف الإدارات المعنية، وامتدادا لذلك قامت الوزارة بشراكة مع مؤسسة الوسيط، في إطار الاستراتيجية الوطنية لمكافحة الفساد، بتنظيم ورشات تكوينية للمكونين في مجال ""استقبال ومعالجة شكايات المرتفقين"" بهدف الاستفادة من خبرة المؤسسة في هذا المجال وإسقاطها على سياق منظومة الشكايات المذكورة سالفا.
وفي هذا الإطار أيضا، نظمت وزارة الانتقال الرقمي وإصلاح الإدارة دورتين تكوينيتين في مجال ""استقبال ومعالجة شكايات المرتفقين"" لفائدة كل من موظفي وحدات تلقي ومعالجة الشكايات لوزارة الاقتصاد والمالية وكذا لمكتب التكوين المهني وإنعاش الشغل.
كما وضعت الوزارة رهن إشارة المرتفقين مركز الاتصال والتوجيه الإداري - 37 37 -بهدف   توجيههم في هذا الشأن، وتذليل المشاكل التي تعترضهم في عملية إيداع وتتبع الشكايات وكذلك تقديم الإرشادات والتوجيهات للمواطنين حول كيفية تقديم وتتبع الشكايات وتوفير الدعم الفني لمستخدمي المنصة الرقمية للشكايات. واستقبال مكالمات المواطنين والتفاعل مع تساؤلاتهم واستفساراتهم بفعالية.
وفي الختام، لا يسعني سوى أن أؤكد لكم مرة أخرى العناية الخاصة التي توليها الحكومة ومن خلالها وزارة الانتقال الرقمي وإصلاح الإدارة لهذا الورش الهام، والتزامها المستمر بتحسين علاقتها بالمرتفقين من خلال تطوير آليات الاستماع والاستجابة الفعالة لشكاياتهم، بما يحقق رضاهم ويرتقي بجودة الخدمات العمومية
وتفضلوا بقبول خالص عبارات التقدير.",1.0,0.9745798957742973,,
